879385888,F77,Lui and Li (2012),"Liu C, Li X. Carbon storage and sequestration by urban forests in Shenyang, China. Urban Forestry & Urban Greening. 2012;11:121–8.","Liu C, Li X. ",China,"Carbon storage and sequestration by urban forests in Shenyang, China. ",2012,Urban Forestry & Urban Greening,Peer-Reviewed Article,liucf898@163.com,N/A,China,Shenyang,"This study focused on the areas within the third-ring road of Shenyang, with an area of 455 km2 (Fig. 1). Shenyang is the capital city of Liaoning Province in northeastern China. It has nine districts and four counties, with a total population of 7.04 million in 2006 (Shenyang Statistical Bureau, 2006).",Northern,41 11' - 42 17' N,122 21' - 123 48' E,N,N/A,Multi-Patch,"Composition, Forested area, Land use type","Two hundred and fifty plots were investigated in our study and the plot number of each urban forest type was determined according to the area of each forest type and its within-type variance of urban forest structure, including species diversity and DBH distribution of trees. The field survey was conducted in September and October, 2006. For the 213 accessible sample plot, forest type was recorded. Within each plot, we recorded the species name, diameter at breast height (DBH), and health condition for each tree. Six types of health condition were included, based on the proportion of dead branches in the crown of a tree.","Above-ground biomass, Below-ground biomass","The biomass of an individual tree is typically calculated based on either the DBH alone, or a combination of the DBH and tree height (H). In this study, we used DBH only as this type of biomass equations does not require the measure of tree height, and thus can reduce uncertainty. In cases only equations that were used to calculate above-ground biomass were available, the whole tree biomass was estimated based on the root-to-shoot ratio of 0.25. Therefore, we gave a 20% biomass reduction only for trees with DBH greater than 30 cm (Nowak, 1994). The dry biomass was then converted to C by multiplying 0.5 (Nowak, 1994; Nowak and Crane, 2002). After that, C density (t/ha) was calculated for each plot. Carbon sequestration was estimated as the difference of C stored between year y and year y + 1, based on the annual growth rates of tree DBH. For deciduous species, C stored by foliage was subtracted, while for evergreen species, there was a 25% of foliage C reduction by assuming 3-year leaf retention. ",2006,2006,N,Individual,"Carbon stored by urban forests was 337,000 t, among which EF and AF accounted for 41% and 34%, respectively. The averaged C density was 33.22 t/ha. Attached Forest had the highest C density (50.17 t/ha), followed by RF, LF, EF, and PF. The annual C sequestration by urban forests was 28,820 t. Similar to carbon storage, the majority of the C was sequestered by EF and AF (40% and 38%, respectively). The C sequestration rate was 2.84 t/ha/yr. For different types of urban forests, the C sequestration rate ranged from 1.16 t/ha/yr for PF to 4.78 t/ha/yr for AF (Table 6). Firstly, Shenyang had fewer big trees than cities such as Sacramento and Beijing. The ages of the trees, or the size of the trees (DBH) affect C storage and sequestration (Nowak, 1994). Generally, large healthy trees store and sequester more C than small health trees (Nowak, 1994). Therefore, Shenyang had a lower C density than these cities. Secondly, urban forests in Shenyang were dominated by fast-growth species (Table 5). This fast-growth species has relatively high rates of C sequestration, in turn leading to a higher C sequestration rate. In addition, the higher C sequestration rate of urban forests in Shenyang may be partly due to the relatively high tree density (Table 7).",Y,Management,Management,N/A,N/A,"This has some important management implications. Firstly, there are still great potentials to increase the total area of urban forests in Shenyang. Currently, the urban forest cover is only 22.28%. The climatic and physiographic condition of Shenyang is very suitable for tree growth. More trees can be planted and more C can be stored and sequestered. In particular, planting trees of native species with fast growth rates may further improve the capacity of C storage and sequestration of urban forests. Our results indicated that the majority of the urban trees were in their early stage, suggesting an increasing C storage density and sequestration rate with the growth of those trees (Nowak, 1994; Yang et al., 2005). However, these young trees in urban areas require careful management and maintenance. In addition, many of the patches of urban forests have a single layer of tree species, with similar ages. Therefore, there are great potentials to enhance the capacity of these urban forests in C storage and sequestration by optimizing their structure, such as the creation of multiple layers of trees, shrubs and grass, and a mixture of trees with different ages.",,DMR
87938570,F78,Capotorti et al. (2017),"Capotorti G, Del Vico E, Anzellotti I, Celesti-Grapow L. Combining the Conservation of Biodiversity with the Provision of Ecosystem Services in Urban Green Infrastructure Planning: Critical Features Arising from a Case Study in the Metropolitan Area of Rome. Sustainability. Multidisciplinary Digital Publishing Institute; 2017;9:10.","Capotorti G, Del Vico E, Anzellotti I, Celesti-Grapow L.",Italy,Combining the Conservation of Biodiversity with the Provision of Ecosystem Services in Urban Green Infrastructure Planning: Critical Features Arising from a Case Study in the Metropolitan Area of Rome,2017,Sustainability,Peer-Reviewed Article,eva.delvico@uniroma1.it,N/A,Italy,Rome,"he city of Rome, a metropolis in Mediterranean Europe, was adopted as a case study (Figure 1). The city covers an area of 345 km2 and represents the central urban sector of the municipality, which covers an area of approximately 1300 km2.",Northern,N/A,N/A,Y,"In particular, the results of this overview represent the basic ecological knowledge underlying the ongoing development of pilot urban GI projects in the metropolitan area of Rome. These projects have been commissioned by the Italian Ministry for the Environment to start implementing the European GI Strategy, and consequently the related Action 6 of the EU Biodiversity Strategy, at the national level.",Multi-Patch,"Land use type, Individual tree management, Native species, Composition, Diversity metric","For these reasons, we analyzed specific features of trees and forests that may, besides being able to deliver multiple ES, be critical to the quality of natural and semi-natural ecosystems in urban contexts. ure in order to find estimates of the capacity of different tree species and forest types to provide ES that may be relevant to our case study (Table 2). ",Above-ground biomass,"Used national level estimates and local level estimates for the city of Rome. The data available at the national level on carbon net primary productivity (Table 3, item E1) were considered as a proxy for carbon mitigation",N/A,N/A,N,Patch,"The ranking of physiognomic types that are characteristic of the urban sector of Rome points to a slightly better performance of evergreen oaks over exotic conifers and deciduous oaks, a medium performance of chestnut, hygrophilous broadleaves, Mediterranean pines and exotic broadleaves, and a minor potential contribution of bushlands and other Mediterranean deciduous broadleaves. Local estimates available at the tree species level (Table 3, item E2) for the native evergreen oak Quercus ilex, for the native deciduous oak Q. pubescens and for the introduced hybrid (native x non-native) broadleaved Platanus hispanica confirm the aforementioned ranking of the respective physiognomic types",Y,"Conservation, Restoration, Management",Conservation,Restoration,Management,"Proactive conservation [82] of the native and spontaneous trees and forest remnants, focusing on those types that are most representative of the local potential natural vegetation. Although this action is markedly oriented toward biodiversity conservation, it always provides an expectedly positive balance between the delivery of maintenance, regulatory and cultural ES, and guarantees the long-term survival and low maintenance costs of the related GI components. Facilitation of the spontaneous natural dynamics, also defined as passive restoration [78], for the recovery of natural forest types in the various environmental units of the city. Wider coverage area of ecologically coherent species and communities may enhance the GI-based delivery of regulating ES (as in the case of particulate matter removal) to a greater extent than a more limited number of trees that may perform better but that are ecologically incoherent (as in the case of evergreen oaks outside strictly Mediterranean-like environments). The effort to recover native trees and forests should prevail over any other expected value of non-native species and communities related to the functional behavior and cost-effective introduction of the latter. Active restoration of seed sources and enhancement of functional connectivity for biogeographically representative and ecologically coherent trees with critical gaps in their present distribution and short-distance dispersal. This action is particularly important in sites with poor native species diversity and a dense artificial matrix.",Many strong action/recommendation items. Interdisciplinary work. ,KHT
879385909,F79,Schmitt-Harsh et al. (2013),"Schmitt-Harsh M, Mincey SK, Patterson M, Fischer BC, Evans TP. Private residential urban forest structure and carbon storage in a moderate-sized urban area in the Midwest, United States. Urban Forestry & Urban Greening. 2013;12:454–63.","Schmitt-Harsh M, Mincey SK, Patterson M, Fischer BC, Evans TP. ",United States of America,"Private residential urban forest structure and carbon storage in a moderate-sized urban area in the Midwest, United States. ",2013,Urban Forestry & Urban Greening,Peer-Reviewed Article,mschmitt@carleton.edu,N/A,United States of America,Bloomington,"This research was carried out in the City of Bloomington, Indiana (United States), located approximately 50 miles southwest of the state capital of Indianapolis (Fig. 1). As of 2010, Bloomington’s population reached 80,405 individuals and 33,239 housing units, making the study site representative of a moderate-sized metropolitan area (US Census Bureau, 2010).",Northern,N/A,N/A,Y,"The surrounding landscape is heavily forested for Indiana, and is composed primarily of secondary successional broadleaf forests located within the beech-maple to oak-hickory transition zone of the Eastern Deciduous Forest (Barrett, 1995). The city itself has been recognized as having one of the highest proportions of canopy cover in the state, at approximately 50% (Heynen and Lindsey, 2003).",Multi-Patch,"Individual tree management, Land use type, Composition","At each parcel, a census of all trees and shrubs was conducted. All trees, including those in the public right of way (PROW), with diameter at breast height (DBH, at 1.37 m above surface) ≥2.5 cm were identified, geo-located using a Trimble GeoExplorer 2008 GeoXH GPS unit, and measured for their DBH and total tree height (H). The height of each species was generalized into six 5-m height classes: 0–5 m, 6–10 m, 11–15 m, 16–20 m, 21–25 m, and 25+ m. Additional information regarding the maintenance of each tree (e.g. presence of mulch, pruning), condition of each tree (0 – dead or dying, 1 poor, 2 – fair, or 3 – good), and presence or absence of infrastructure conflicts was collected.","Above-ground biomass, Soil, Below-ground biomass","The aboveground and belowground (coarse root) biomass of each tree was calculated using i-tree Eco (previously known as UFORE, Urban Forest Effects) (Nowak and Crane, 2002b). his approach involves the conversion of tree DBH to aboveground biomass using published allometric models (species–specific, where available). Aboveground biomass estimates were then converted to whole tree biomass based on the assumed root-to-shoot ratio of 0.26 (Cairns et al., 1997). To adjust for the moisture content of species, whole tree biomass estimates were multiplied by a factor of 0.48 for conifers and 0.56 for hardwoods (Nowak et al., 2002a, 2008). To adjust for the open-grown canopy cover of urban trees, biomass results were multiplied by 0.8 (Nowak, 1994; Nowak et al., 2008). Finally, whole tree biomass was converted to total tree carbon by multiplying by 0.5.",2011,2011,N,Individual,"The total amount of carbon stored on individual parcels ranged from 1.7 kg m−2 to 18.8 kg m−2, with a mean of 7.2 kg m−2 (Table 4). For all but 12 parcels, soil carbon (to 15 cm depth) exceeded the carbon stored in tree biomass. Soils stored 4.7 kg C m−2, approximately 1.9 times higher than the carbon stored in trees (2.5 kg C m−2), on average (Table 4). The deviation around the mean for tree carbon greatly exceeded that for soil. For example, one parcel stored 11.2 kg C m−2 in tree biomass while another parcel stored less than 0.002 kg C m−2. Two species dominated in basal area, A. saccharinum and F. americana, and accounted for 20.6% and 16.3% of the total carbon stored in our sampled tree population, respectively.On average, older parcels (calculated as time since housing development) in our sample were characterized by higher tree and soil C stocks than newer parcels (Fig. 4).",Y,Management,Management,N/A,N/A,"One limitation of current guidelines is the focus on quantifying species diversity in terms of relative abundance rather than relative dominance or species importance, particularly as the provision of ecosystem services is debatably more closely linked to the latter. Our data demonstrates some tree species (e.g. A. saccharinum; F. americana) to be more important, in terms of basal area and associated carbon storage, than is implied by counting their presence relative to the total population. For example, species in the genus Fraxinus accounted for 19.4% of the total carbon stored in our tree population. Given concerns over the EAB (Poland and McCullough, 2006; City of Bloomington, 2012), it is expected that widespread die-off or removal of Fraxinus trees will result in substantial losses of stored carbon from Bloomington’s residential urban forest, as well as shifts in the age distribution of the tree population. Thus, our research demonstrates there are bigger tree-species “winners” in terms of basal area and the provision of carbon storage services than there are by relative abundance. It seems appropriate, therefore, that management strategies should consider diversity not only in terms of species presence (relative abundance), but also species size (relative dominance) and in combination, species–specific size distributions, to ensure the provisioning of ecosystem services over time.",,DMR
879385907,F80,Raciti et al. (2014),"Raciti SM, Hutyra LR, Newell JD. Mapping carbon storage in urban trees with multi-source remote sensing data: Relationships between biomass, land use, and demographics in Boston neighborhoods. Science of the Total Environment. 2014;500–501:72–83.","Raciti SM, Hutyra LR, Newell JD.",United States of America,"Mapping carbon storage in urban trees with multi-source remote sensing data: Relationships between biomass, land use, and demographics in Boston neighborhoods.",2014,Science of The Total Environment,Peer-Reviewed Article,Steve.M.Raciti@Hofstra.edu,N/A,United States of America,Boston ,"Our analysis focused on Boston, Massachusetts (42.356°N, − 71.062°W; land area of 125 km2). Boston is the northernmost city of the largest megalopolis in the United States, which extends from Boston to Washington DC.",Northern,"45° 21' 21.6""","-71° 3' 43.1994""",Y,"Like many North American cities, the greater Boston region has experienced significant population growth and subsequent widespread urbanization over the past several decades, most of which has occurred well outside of the urban core. As one of North America's oldest cities, Boston proper has been extensively developed and built-out; however, the City has some of the nation's oldest and most well known parklands and open spaces.",Multi-Patch,"Land use type, Composition, Canopy cover","NDVI as a proxy for vegetation cover. To build a citywide biomass estimate, diameter-based allometric biomass equations from Jenkins et al. (2003) were applied to the City of Boston's street tree database (Urban Ecology Institute, 2008)and used in combination with the segmented tree crowns and LiDAR metrics. The most specific allometric equation possible was used in all cases; where species or genus level equations were unavailable, we applied the Jenkins et al. (2003) miscellaneous hardwood or softwood equations.",Above-ground biomass,"One half of live plant biomass was assumed to be carbon. Note that results from McHale et al. (2009) andTimilsina et al. (2014) suggest problems with the application of forest-derived allometries to urban trees; however, urban tree allometries were not available for the regional species assemblage. It is unclear if the use of urban-specific allometric equations would have increased or decreased the estimated carbon stocks in the most urban plots; this is an area that requires additional research. ",2006,2007,N,Patch,"The biomass map developed in this study (Fig. 3)affirms that urban ecosystems can have potentially large aboveground tree carbon stocks, but that these C stocks are heterogeneously distributed across land use/land cover types. We estimated a mean biomass of 28.8 Mg C ha−1 and total C storage of 355 Gg C for trees in the City of Boston. Within the City, urban forest patches contained the largest vegetation carbon stocks on a per-area basis (110.7 Mg C ha−1), followed by residential (32.8 Mg C ha−1), and then parks, recreation, and developed open spaces (23.5 Mg C ha−1). Residential land uses covered 41% of total land area and contained the largest proportion of the total C stocks (46.7%). Urban forest patches covered 8.4% of the land area and contained 32.2% of total C stocks in the City.",N,N/A,N/A,N/A,N/A,N/A,,KHT
879385910,F81,Jo et al. (2020),"Jo H-K, Kim J-Y, Park H-M. Carbon and PM2.5 Reduction and Design Guidelines for Street Trees in Korea. Sustainability. Multidisciplinary Digital Publishing Institute; 2020;12:10414.","Jo H-K, Kim J-Y, Park H-M. Carbon and PM2.5 ",Republic of Korea,Carbon and PM2.5 Reduction and Design Guidelines for Street Trees in Korea.,2020,Sustainability,Peer-Reviewed Article,jykim84@kangwon.ac.kr,N/A,Republic of Korea,"Seoul, Daejeon, Gaegu, Chuncheon, Suncheon","Seoul, Daejeon, and Daegu are either capital or metropolitan cities with a high population density, while Chuncheon and Suncheon are small and medium-sized cities with a relatively lower population density.",Northern,N/A,N/A,N,N/A,Region,"Land use type, Composition","The sample points along the streets in the study cities were visited, and a survey plot for each point was etablished up to 40m on each side in length from the point, and the building boundaries along both sidewalks in width (fig 1). The field survey data included the species, stem diameter (DBH 1.2m) for trees), height, crown width, vertical structures, and pruning status. Vertical structures were divided into single layered ant multi-layered structures,",Above-ground biomass,"The C uptake per tree was estimated using the quantification models developed for the urban trees of each species [11,25–30] (Table 1). The quantification models, which apply the stem diameter as the independent variable, were derived from measurements of the seasonal CO2 rate of exchange of urban trees or were based on the direct harvesting method.",N/A,N/A,N,Patch,"The density of the planted street trees ranged from 0.1 to 6.0 trees/100 m2 in this study, with an average density being 1.0 ± 0.1 trees/100 m2 (Table 3). Daejeon had the highest tree density (1.4 trees/100 m2), followed by Seoul and Daegu (both with 1.0 trees/100 m2), Chuncheon (0.9 trees/100 m2), and Suncheon (0.8 trees/100 m2). The C uptake by planted street trees per unit area in the study cities ranged from 0.1 to 3.9 t/ha/y, with an average uptake being 0.64 ± 0.08 t/ha/y (Table 4). Daejeon, with the relatively highest rates of tree density and cover, had the highest C uptake at 0.72 ± 0.07 t/ha/y, followed by Seoul at 0.70 ± 0.08 t/ha/y, Suncheon at 0.67 ± 0.09 t/ha/y, and Daegu at 0.66 ± 0.09 t/ha/y. On the other hand, Chuncheon, which had a lower tree cover ratio than the other cities, had a C uptake of 0.46 ± 0.06 t/ha/y (the lowest). C uptake by street trees in this study was about 51% lower than the C uptake of 1.3 t/ha/y in street trees of Beijing, China [16]. This result might be attributable to differences in the size and density of the planted trees. The C uptake by planted street trees per unit of tree cover ranged from 0.11 to 2.51 kg/m2/y depending on the study cities, with an average uptake being 0.53 ± 0.04 kg/m2/y.",Y,Management,Management,N/A,N/A,"In addition, it is recommended that larger trees be planted, rather than small trees, as well as tree species with good growth rates such as Zelkova serrata, Prunus yedoensis, Pinus koraiensis, and Pinus densiflora [45]. Moreover, tree planting space for tree growth should be expanded. As a result of this study, many streets were found with insufficient tree planting or with wide planting intervals that require supplementary tree planting.",,DMR
879385913,F82,Wang et al. (2021),"Wang X, Wang Y, Qu X, Huang B, Li Z, Sun J, et al. Urban trees in university campus: structure, function, and ecological values. Environmental Science and Pollution Research. 2021;28:45183–98.","Wang X, Wang Y, Qu X, Huang B, Li Z, Sun J, et al.",China,"Urban trees in university campus: structure, function, and ecological values.",2021,Environmental Science and Pollution Research,Peer-Reviewed Article,xyyang0821@163.com,N/A,China,Fushun,"The research was conducted in the campus of Shenyang Institute of Technology (SIT), a university located in Shenfu New City, Fushun, China. Fushun is a national forest city with an urban area of 713 km2 and a population of 2.19 million.",Northern,41 52',123 55',N,N/A,Patch,"Land use type, Composition","A complete tree inventory was conducted to collect the information of all tree populations in the campus of Shenyang Institute of Technology in 2019. The tree information was recorded according to the i-Tree Streets manual, including tree species, diameter at breast height (DBH), and crown width.",Above-ground biomass,The carbon storage of urban trees was calculated according to the biomass equation (McHale et al. 2009). The annual carbon sequestration was calculated from species-specific growth curves and biomass equations.,2019,2019,N,Individual,"Ecosystem services produced by campus trees are directly proportional to the number of trees, canopy coverage, and plant leaf surface area. The trees in SIT stored a total of 856,226 kg of carbon, valued at $128,360.  Annual carbon sequestration of campus trees totaled 105,296 kg, valued at $15,785. In our study, the benefits provided by C. ovata, S. babylonica,and R. pseudoacacia accounted for half of the benefits of all trees in the campus (Fig. 8a). The total benefits produced by C. ovata were the largest among all trees because of its largest population. But on a per tree basis, the average benefit of C. ovata ($31.2/tree) was lower than that of U. pumila ($38.7/tree) due to the lack of mature trees, and slightly higher than the average level of all trees ($29.6/tree).",N,N/A,N/A,N/A,N/A,N/A,,KHT
