Rayyan.ID,Article.ID,Citation,Auth,Country.Auth,Title,Year,Journal,Pub.Type,Email,Supp,Study.country,City,Geo.region,Hem,Lat,Long,Urb.scale,Forest.comp,Desc.forest,#Species,Common.name,Latin.name,Field.history,Desc.field,Start.year,End.year,Month.start,Month.end,Intervalled,Comparator,Scale.meas,Bird.domainraw,birddomain1,birddomain2,birddomain3,birddomain4,Bird.category,Category.multi,Result,Rec.,Rec.type,Rec.1,Rec.2,Rec.3,Rec,Comments,Reviewer.intial
364026273,A83,Yu & Guo (2013),"Yu T, Guo Y.",China,Effects of urbanization on bird species richness and community composition. ,2013,Pakistan Journal of Zoology,Peer-Reviewed Journal,yutonglei_00000@163.com,N/A,China,Nanchong,"Nanchong, the third largest city in Sichuan",Northern,N/A,N/A,Multi-patch,Land use type,"Woodlot habitats, dominant tree species include Sabina chinensis,
Neosinocalamus afinis, Ficus virens, and Pinus
massoniana. Additionally, Robinia pseudoacacia,
Rosa laevigata, Myrsine Africana, Festuca ovina,
Pteris vittata, Dicranopteris dichotoma, and
Duchesnea indica grow beneath trees or at the forest margins.",Many,More than 10,More than 10,N,N/A,2004,2005,November,July,N,Y,Community,Biodiversity,Biodiversity,,,,Abundance,Abundance,"Twenty-two bird species were found in all three of the habitat types studied here (these
constituted 27.8% of the species observed in River habitats, 40.0% of those observed in Agricultural habitats, and 31.4% of those found in Woodlot habitats).In Woodlot habitat, a total of 2,417 bird observations (31.7% of all detections) were recorded, representing 70 bird species in 30 families. The results indicated that Pycnonotus sinensis (5.1%), Aegithalos concinnus (4.4%), Spodiopsar cineraceus (3.4%), Egretta garzetta (2.7%), Carduelis sinica (2.3%), and Sinosuthora webbiana (2.2%) were the three most dominant bird species in this habitat. Reif et al. (2008) found that species more closely associated with lowland broad-leaved forest had on average more positive population trends, whereas species more closely associated with coniferous forest had on average more negative population trends. Coniferous forest is dominant in our study area, because humans have cut down the natural forests since the 1950s. We found that Woodlot habitat did not sustain diversity larger than that of the other habitats, presumably because the available forest patches were smaller than the threshold size required by birds (Beissinger and Osborne, 1982). ",No,N/A,N/A,,,N/A,,RK
364025658,A84,Sol et al. (1997),"Sol D, Santos DM, Feria E, Clavell J.",Spain,Habitat Selection by the Monk Parakeet during Colonization of a New Area in Spain.,1997,The Condor,Peer-Reviewed Journal,N/A,N/A,Spain,Barcelona,"The study was conducted in the city of Barcelona (NE Spain), excluding industrial areas and mountainous zones of the periphery.",Northern,N/A,N/A,Multi-patch,"Composition, Canopy Cover","In Spain, parakeet nests have been found in palms (Phoenix spp.), eucalyptus (Eucalyptus spp.), pines. Thus, nest-site availability was estimated by counting the individuals of these four tree species in each square. % Forest Cover. ",One,Monk Parakeet ,Myiopsittu monachus,N,N/A,1992,1994,N/A,N/A,N/A,N,Individual,"Biodiversity, Breeding",Biodiversity,Breeding,,,"Abundance, Nesting survival",≥ Two topics,"Most of the nests were located in palms, a few in pines, and the rest in a Trachycarpus sp., an elm, and on a wall covered by Ivy (Hedera helix). There were significant differences between used and random squares (Table 2), the former tending to contain more palms and food, a higher percentage of park area, and to be located near urban parks. Squares containing forest areas were not used by parakeets. ",No,N/A,N/A,,,N/A,,KHT
364025679,A85,Blewett & Marzluff (2005),"Blewett CM, Marzluff JM. ",USA,Effects of urban sprawl on snags and the abundance and productivity of cavity-nesting birds. ,2005,The Condor,Peer-Reviewed Journal,corvid@u.washington.edu,N/A,USA,Seattle," 49, 1-km2 ‘‘suburban landscapes’’ within a 3200 km2 area
of temperate, moist forest around Seattle, Washington",Northern,N/A,N/A,Multi-patch,"Composition, Land use type","Density of snags in 49 sites (1-km2 “suburban landscapes” that included built and forested portions), and the diameter, height, decay status, and species of individual snags. count of all live trees and record of their species. Live tree densities (trees ha−1), percent of each species, and mean DBH.",Many,"Black-capped Chickadee, Red-breasted Nuthatch, Northern Flicker, Downy Woodpecker, Brown Creeper, Chestnut-backed Chickadee,  Pileated and Hairy Woodpecker, Red-breasted Sapsucker","Poecile atricapillus, Sitta canadensis, Colaptes auratus, Picoides pubescens, Certhia americana, Poecile rufescens, Dryocopus pileatus, Picoides villosus, Sphyrapicus ruber",N,N/A,2001,2001,April,July,N,Y,Community,"Biodiversity, Breeding",Biodiversity,Breeding,,,"Biodiversity metric, Species distribution, Macro breeding, Abundance, Meso breeding",≥ Three topics,"Snags, especially red alder (Alnus rubra), were abundant in sites' forested portions, but rare in the built portions. Snag density was positively correlated with density of live trees. Snags in built versus forested portions were similar in all attributes except decay, which was more advanced in forested areas. In the oldest suburbs (60–80 years old), snags in forested portions were larger, more decayed, and more likely to have broken tops than those in younger suburbs (2–20 years old). Cavity-nesting bird species richness and equity of individuals per species was highest in suburban landscapes where remaining forest was not fragmented, but adjacent to highly intermixed urban and urban-forest land covers. Suburban landscapes with highly interspersed land covers had higher densities of Black-capped Chickadees (Poecile atricapillus), Red-breasted Nuthatches (Sitta canadensis), Northern Flickers (Colaptes auratus) and Downy Woodpeckers (Picoides pubescens); suburban landscapes with higher percentages of forest had higher densities of Brown Creepers (Certhia americana), Chestnut-backed Chickadees (Poecile rufescens), Pileated (Dryocopus pileatus) and Hairy Woodpeckers (Picoides villosus). Red-breasted Sapsucker (Sphyrapicus ruber) densities were positively correlated only with the density of snags. Cavity-nesting birds bred successfully in all landscapes; seven of the nine species produced fledglings in >50% of their nesting attempts. Snags important for nesting were larger in diameter, taller, and more decayed than expected based on availability. Snags with active nests also had evidence of previous use, fungal conks, broken tops, and substantial bark.",Yes,Management,Management,,,"The importance of snag density and 1-km2-scale landscape attributes (amount of remaining forest, and interspersion of forest and built areas) to cavity-nesting birds differed by species, suggesting that conservation of this guild in areas of rapid urban development may need to be addressed at multiple scales and requires planners to make trade-offs between species. Fortunately, retaining forest and interspersing forest and built areas are not necessarily mutually exclusive. Sites with high interspersion of forest and urban areas require at least moderate amounts of forest: one site had 27% forest and contained all nine species of birds. This site was 30-years old, which suggests that this amount of forest can maintain cavity-nesting bird populations following development.

Variety in development pattern may become increasingly important as large areas of forest are developed. To increase densities and reproductive success of all species, different patterns of developments with differing amounts of percent forest would be prudent. For example, planners in the Pacific Northwest should design some developments that retain at least 60% forest for every 100 ha developed, where mean forest patch sizes are 20–30 ha, and some that have 27% to 60% forest in a variety of patch sizes interspersed with urban areas. Forested parks (70%–96% forest; large mean forest patch sizes 23–30 ha; very small mean urban patch sizes 0.14 to 0.74 ha) would complement these urban areas for the benefit of cavity-nesting birds. When deciding which forest areas to conserve, we recommend targeting conservation efforts to areas with high densities of existing snags (>8 snags ≥25 cm DBH ha−1), and live trees (>318 trees ha−1). These management suggestions would also provide the diversity of forest conditions used by mature and early-successional forest songbirds (Donnelly 2002, Donnelly and Marzluff 2004).

Active management may be needed within built portions of suburban landscapes to conserve snags with characteristics important to cavity-nesters. Based on snags used by cavity-nesting birds in our study, efforts should be made to conserve all snags that are large in diameter (minimum of 30–40 cm), more decayed (class 2), red alder and coniferous species, taller (>18 m), with broken tops, with some bark remaining, with conk fungus, and containing other cavities. ",,RK
364025683,A86,Gleditsch and Carlo (2011),"Gleditsch JM, Carlo TA.",USA,Fruit quantity of invasive shrubs predicts the abundance of common native avian frugivores in central Pennsylvania.,2011,Diversity and Distributions,Peer-Reviewed Article,jmg5214@gmail.com,N/A,USA,Centre County,"To select point count locations, a rectangular grid was laid over a map of the State College area in Centre County, Pennsylvania (Fig. 1). The grid was made of 30 2.5 · 2.5 km squares and measured 15 · 12.5 km. The grid was centred at the Penn State University Campus",Northern,"40°47' 44""N","77°51'52""",Patch,"Composition, Land use type","We conducted a fruit-removal experiment using 78 potted black nightshade plants (Solanum americanum – greenhouse grown) bearing ripe fruit in September of 2009 at two sites in the State College area in Centre County, PA. The objective was to test for differences in fruit-removal rates for a native plant species in two contrasting backgrounds.",Many,More than 10,More than 10,N,N/A,2009,2009,September,October,Y,N,Individual,"Behaviour, Biodiversity",Biodiversity,Behaviour,,,"Foraging/Movement, Species distribution, Biodiversity metric",≥ Two topics,"We recorded a total of 34 species of birds and at least 22 species of fleshy-fruited zoochorous plants (see Appendix S1 & S2 in Supporting Information). In censuses, frugivorous robins and catbirds were the two most abundant and frequently detected bird species, accounting for 31.7%.  The abundance of catbirds, robins, and American goldfinches (Carduelis tristis) were positively correlated with Lonicera fruit, while counts of red-bellied woodpeckers (Melanerpes carolinus), downy woodpeckers (Picoides pubescens) and dark-eyed juncos (Junco hyemalis) were negatively correlated with Lonicera fruit. When looking at the influence of land cover types on the numerically dominant bird frugivores (i.e. catbirds and robins), we found that the land cover around each point did not have a significant effect on the frugivore abundance.",Yes,Management,Management,,,"Our results advise caution to be taken in conducting control and eradication practices since reductions in Lonicera could negatively impact frugivore abundance, which could have undesirable ecological and economical consequences in both local and distant regions. We argue that in the case of Lonicera, control can be locally targeted to favour the dispersal and establishment of native species where it seems fit. However, a widespread and rapid eradication of large patches of dense Lonicera across the landscape might pose a greater immediate threat to biodiversity if control programs do not account for the loss of resources for bird mutualists and other consumers.",,KHT
364025685,A87,Bakermans and Rodewald (2006),"Bakermans MH, Rodewald AD.",USA,Scale-Dependent Habitat use of Acadian FlyCatcher (Empidonax Virescens) in Central Ohio.,2006,The Auk,Peer-Reviewed Article,bakermans.1@osu.edu,N/A,USA,"Franklin, Pickaway, and Delaware counties","Thirty-six riparian forest sites were selected in Franklin, Pickaway, and Delaware counties, Ohio, which averaged 57.2% agriculture–open land, 29.6% urban (i.e. paved or built-up land), and 6.3% forest",Northern,N/A,N/A,Patch,"Composition, Forested area, Land use type","Forest width, vegetation density, snags, small trees, large trees, % urban",One,Acadian Flycatcher,Empidonax virescens,N,N/A,2001,2002,May,August,Y,N,Individual,Biodiversity,Biodiversity,,,,Abundance,Abundance,"Percentage of urban cover at the landscape scale best explained observed variation in abundance of Acadian Flycatchers (∆AICc = 0, ωi = 0.76; Table 4), and was 4.7× more likely than other models based on Akaike weights. We found no evidence that our measures of vegetation structure and arthropod biomass were potential causes of these landscape associations. In other words, vegetation structure within a stand did not change as the landscape shied from a rural to urban matrix or with varying forest width. Vegetation density was 2.5× lower within the nest patch than throughout the stand, which suggests that Acadian Flycatchers avoided areas with dense understory vegetation, possibly associated with invading exotic shrubs (e.g. amur honeysuckle and multiflora rose). One of our most striking findings was that numbers of Acadian Flycatchers were negatively related to the amount of urban development within 1 km.  Acadian Flycatchers required wider riparian forests (≥105 m) than those in rural landscapes (≥85 m).",Yes,Management,Management,,,"Land managers and biologists should consider a multiscale approach when designing or improving reserves that addresses landuse planning at landscape scales coupled with habitat management. Although management at the local scale may be more convenient, a central challenge facing ecologists and managers will be synthesizing the complex factors that influence animal populations and communities across scales into clear, usable management approaches.",,KHT
364025665,A88,Friesen et al. (2013),"Friesen LE, Casbourn G, Martin V, Mackay RJ.",Canada,Nest predation in an anthropogenic landscape.,2013,The Wilson Journal of Ornithology,Peer-Reviewed Article,lyle.friesen@ec.gc.ca,N/A,Canada,Waterloo,"The Region of Waterloo, Ontario (population 553,000; 2011 estimate, www.regionofwaterloo.ca), which encompasses a 1,369 km- area in southwestern Ontario.",Northern,N/A,N/A,Patch,"Forested area, Composition, Canopy Cover","We conducted field work during 2006-2010 in 14 woodlots in the Region of Waterloo, Ontario. The study sites consisted of upland deciduous forest and were located in an agricultural/urban-suburban landscape with 14% forest cover and a mean forest patch size of 12.8 ha.",One,Wood Thrushes ,Hylocichia mustelina,N,N/A,2006,2010,N/A,N/A,Y,N,Community,Survival,Survival,,,,"Nesting survival, Individual survival/mortality",≥ Two topics,"Three species contributed to the majority (61%) of prédation events (Table 1). Brown-headed Cowbirds were the most frequently recorded predators (n = 15 events, all in the incubation stage). Our study provides further evidence that the abundance of a potential nest predator species does not automatically equate to actual risk of prédation for a songbird species, and that the cast of species regularly identified as common nest predators in urban and fragmented habitats may require revision with respect to their individual importance. Contrary to our prediction, we found support for effects of higher levels of urban pressure reducing the probability of prédation. In our case, the reverse was true; as housing intensity increased in and around a nest site, the chance of a prédation event decreased. The probability of prédation in our study area was unaffected by forest size or percent forest cover. Such lack of infiuence could be attributed to the fact that all our woodlots were of relatively small size and that regional forest cover was so low that any possibility of meaningful association became irrelevant as larger radii were used in the models. ",No,N/A,N/A,,,N/A,,KHT
364025708,A89,Lee et al. (2010),"Lee D, Kim E, Choi J, Oh K.",South Korea,"The effects of development on forest-patch characteristics and bird diversity in Suji, South Korea.",2010,Landscape and Ecological Engineering,Peer-Reviewed Article,ey1230@snu.ac.kr,N/A,South Korea,Suji,"This report used three overlapping study areas located in the Suji District of Yongin City, Gyunggi Province, South Korea.",Northern,N/A,N/A,Multi-patch,"Fragmentation, Forested area","Four Landsat images dating from 1990, 1995, 2000, and 2003 were analyzed. Changes to forest-patch characteristics from 1995 to 2003 were compared among the four projects in an area extending 300 m adjacent to the developed areas as Study Area One. Study Area Two was used to analyze how a single and continuous patch of mature forest shrinks and fragments as development expands.",Many,More than 10,More than 10,N,N/A,1999,2003,N/A,N/A,N/A,Y,Community,Biodiversity,Biodiversity,,,,"Abundance, Biodiversity metric",≥ Two topics,"Forest-edge areas have a relatively low quality of vegetation and appear to be significantly affected by human activities. There was an average 14.3 species of birds in the interior areas of the continuous forest studied compared with 7.0 in the edge areas (Table 1). There was a similar drop in the number of individuals observed, with an interior number of 30.3 and an edge area number of 15.75. Isolated forests—forests too small to have identifiable interior and edge areas—had similar quantities of individual birds as the interior areas of the continuous forest studied (29.33 compared with 30.3). There was fauna habitat loss in these areas, and bird diversity and the number of individuals observed was seen to decrease from the interior areas to the edge areas. Forest fragmentation into smaller, isolated forests was seen to reduce bird diversity nearly to the levels seen in the edge areas. Developments cause a forest loss, fragmentation, and a lowering of bird diversity; in particular, expansion of the edge area makes the bird species found in the interior particularly vulnerable.",No,N/A,N/A,,,N/A,,KHT
364025710,A90,Solonen (2008),Solonen T.,Finland,Larger broods in the Northern Goshawk Accipiter gentilis near urban areas in southern Finland.,2008,Ornis Fennica,Peer-Reviewed Article,tapio.solonen@pp.inet.fi,N/A,Finland,Uusimaa,"The main study area was situated in the municipalities of Helsinki, Espoo, Vantaa, and Sipoo, but some data from the surrounding Nurmijärvi, Tuusula, Hyvinkää, Mäntsälä, Pornainen, Askola, and Porvoo were also included.",Northern,60° N,25° E ,Patch,Land use type,"Densely built-up habitats were characterized by urban-type land use, and included traffic routes, industrial areas, commercial houses, and groups of buildings of at least 200 inhabitants not allowing any gaps of typically more than 200 meters, as defined by Statistics Finland. The gaps were usually parks, recreational forests, and small plots of more or less natural open habitats. Other, larger agricultural, silvicultural and wilderness areas were defined as rural. The approximate distance (to the nearest km) of nestsites from the nearest densely built-up area served as an indicator of the urban effect on the brood size.",One,Northern Goshawk,Accipiter gentilis,N,N/A,1976,2007,N/A,N/A,N/A,N,Individual,Breeding,Breeding,,,,Micro breeding,Micro breeding,"In general, near-urban habitats seemed to offer nesting conditions and food supply that are stable as compared to those of the rural environments of the district for the following reasons. The brood size in the urban habitats might be larger than in the rural ones due to a high and stable prey supply. From a conservation point of view, the urban and semi-urban Northern Goshawk territories seemed to be of particular value. Therefore, I suggest that urban planners take care of the even and continuous availability of parks growing mature trees and natural kinds of forests.",No,N/A,N/A,,,N/A,,KHT
364025718,A91,Harrisson et al. (2013),"Harrisson KA, Pavlova A, Amos JN, Takeuchi N, Lill A, Radford JQ, et al.",Australia,Disrupted fine-scale population processes in fragmented landscapes despite large-scale genetic connectivity for a widespread and common cooperative breeder: the superb fairy-wren (Malurus cyaneus).,2013,Journal of Animal Ecology,Peer-Reviewed Article,katherine.harrisson@gmail.com,N/A,Australia,13 cities (Box-Ironbark Region),"The Box-Ironbark region in north-central Victoria, Australia, extends over c. 20 500 km2.",Southern,N/A,N/A,Multi-city,"Fragmentation, Canopy Cover","We used tree cover as an approximate measure of suitable superb fairy-wren habitat/ structural connectivity. Fragmented landscapes varied in extent of tree cover: we denote landscapes with 11–20% total tree cover as low-cover fragmented, and landscapes with 25–45% total tree cover as highcover fragmented (Fig. 1; Table 1). Three landscapes with the highest extent of continuous tree cover remaining in the region were used as reference landscapes (> 70% tree cover; Fig. 1).",One,Superb fairy-wrens,Malurus cyaneus,N,N/A,N/A,N/A,N/A,N/A,N/A,Y,Individual,"Demographics/Patterns, Biodiversity",Demographics/Patterns,Biodiversity,,,"Biodiversity metric, Population changes",≥ Two topics,"Box-Ironbark region was constrained mainly by distance rather than structural connectivity (physical continuity of habitat). Models of decreased mobility through treeless compared with treed areas best described genetic patterns for male superb fairy-wrens, indicating that dispersal patterns of males may be altered by biotic and/or abiotic changes associated with habitat loss and fragmentation. Our detection of elevated genetic similarity among female superb fairy-wrens in sites in low-cover landscapes compared to our reference landscapes (like the continuous-cover area of Double et al. 2005) may be indicative of disrupted fine-scale population processes. Fairywrens in the lowest cover landscapes had significantly lower genetic diversity. While superb fairy-wrens may be able to successfully utilize the structural modifications and resources of some urbanized environments (Trollope, White & Cooke 2009), our study suggests that the type of land-use change (e.g. large tracts of land cleared for agriculture) experienced in the Box-Ironbark region has had negative consequences for fine-scale population processes.",Yes,"Restoration, Management",Restoration,Management,,"Effective management of fairy-wren populations may require revegetation or restoration of habitat adjacent to areas of existing habitat in low-cover landscapes, which will provide additional habitat and improve the capacity for male short-distance dispersal and female-mediated extra-group copulation (i.e. local gene flow mechanisms).",,KHT
364025725,A92,Phillps et al. (2020),"Phillips, J., Cooper, J., Luther, D., Derryberry, E.",USA,Territory Quality Predicts Avian Vocal Performance Across an Urban-Rural Gradient.,2020,Frontiers in Ecology and Evolution,Peer-Reviewed Article,jnphilli26@gmail.com,N/A,USA,San Francisco,Urban San Francisco Region,Northern,N/A,N/A,Region,"Canopy Cover, Forested Area",The leaf area density (LAD) was selected to accurately measure productivity within 50 m of each activity center for two vertical strata above the ground: undergrowth (LAD1: 0.5–2 m) and canopy vegetation (LAD2: >2 m). ,One,Nuthall's White-crowned Sparrow,Zonotrichia leucophrys nuttalli,N,N/A,2016,2016,N/A,N/A,N,Y,Population,"Behaviour, Survival",Behaviour,Survival,,,Oral communication,Oral communication,"Noise had a negative effect on performance, and was significant at three levels (Dialect Region, Location, and Territory; Figure 1). However, only two candidate models were within 2 AICc, where Dialect Region noise had the most important influence on vocal deviation. Males in quieter locations have higher performance. Vocal performance of male white-crowned sparrows correlates with background noise levels and landscape features of the breeding territories they defend, but not with body condition. measure body condition",No,N/A,N/A,,,N/A,,CC
