Rayyan.ID,Article.ID,Citation,Auth,Country.Auth,Title,Year,Journal,Pub.Type,Email,Supp,Study.country,City,Geo.region,Hem,Lat,Long,Urb.scale,Forest.comp,Desc.forest,#Species,Common.name,Latin.name,Field.history,Desc.field,Start.year,End.year,Month.start,Month.end,Intervalled,Comparator,Scale.meas,Bird.domainraw,birddomain1,birddomain2,birddomain3,birddomain4,Bird.category,Category.multi,Result,Rec.,Rec.type,Rec.1,Rec.2,Rec.3,Rec,Comments,Reviewer.intial
364026617,A158,Strohbach et al. (2014),"Strohbach MW, Hrycyna A, Warren PS",USA/ Germany,"150 years of changes in bird life in Cambridge, Massachusetts from 1860 to 2012",2014,The Wilson Journal of Ornithology,Peer-Reviewed Journal,michael.strohbach@geo.hu-berlin.de,N/A,USA,Cambridge,"Cambridge is located at the Massachusetts Bay
in the northeastern USA (42u 229 N, 71u 069 W)",Northern,"42 22' 00""","71 06' 00""",Patch,Canopy Cover,"The earliest available summer aerial photos date to 1951 and were scanned from the library collection of the University of Massachusetts – Amherst. We orthorectified them in ESRI ArcGIS 10.1, based on 2010 aerial photos (provided by the city of Cambridge IT Dept.), and digitized tree canopy on sites A and B. Likewise, the 1971 aerial photos were accessed and processed. Finally, the current canopy cover was digitized using the city of Cambridge LIDAR scan from 2009 and the 2010 imagery (provided by the city of Cambridge IT Dept.).",Many,More than 10,More than 10,Y,"Site A (William Brewster’s Site).—William Brewster’s house dates back to colonial times but was moved and expanded since then (Daughters of the American Revolution 1907). In 1860–1873, when Brewster began recording birds, the streets along the gently sloping property were lined with tall elms and lindens. Behind the house there was a flower and vegetable garden, an apple and pear orchard, rows of berry bushes, mowing fields and a small pasture for cows and horses. The neighboring estates were of similar character and open farmland strehed  west and north. Site B (Charles F. Walcott’s Site).—Charles F. Walcott moved the study site to his property, ,140 m north of Brewster’s. At the time of his first survey in the 1940s, he describes it as
‘‘pleasingly variegated’’ and as being covered with a thick tangle of berry bushes, shrubs, and trees. It also contained an old apple and pear orchard (Walcott 1974, Fig. 2).",1860,2012,June,July,Y,N,Community,Demographics/Patterns,Demographics/Patterns,,,,Community changes,Community changes,"Evidence from the reported time series highlights that choices we make in urban environments can have positive as well as negative effects on bird populations. Most bird species disappeared during periods after major building developments and in that respect, the recent trend of re-urbanization and densification of Cambridge and other cities has to be carefully monitored and mitigated. Planting of trees and ending pesticide spraying seem to have contributed to stabilizing or even increasing populations of several bird species in Cambridge.",Yes,Management,Management,,,The patterns revealed in this analysis of 150 years of changes in bird life in Cambridge provide further support for urban planning guidelines for preservation of large urban green space and retention of higher densities of mature urban trees in residential areas.,,RK
364026624,A159,de la Hera (2019),de la Hera I,Ireland,Seasonality affects avian species distribution but not diversity and nestedness patterns in the urban parks of Vitoria–Gasteiz (Spain),2019,Animal Biodiversity and Conservation,Peer-Reviewed Journal, delaheraivan@gmail.com,N/A,Spain,Vitoria-Gasteiz,"Vitoria–Gasteiz (42º 50' 58.4'' N 2º 40' 14.8'' W; 525 m a.s.l.; c.a. 250,000 inhabitants) is located in Northern Iberia (Araba, Basque Country, Spain)",Northern,"42 50' 58.4""","2 40' 14.8""",Patch,"Composition, Canopy Cover, Diversity metric","Vitoria–Gasteiz council provided (fully transferred on the 16 I 15) the most updated digital information on urban vegetation. This enabled accurate estimates following the variables of the parks (table 1): grass cover, shrub cover, tree density, and tree diversity (measured as the effective number of tree species). Between 2 and 6 geographic locations within each park were selected randomly to visually estimate the tree height and trunk diameter at breast height of the 15 closest trees, since this information was not operational in the digital data provided by the city council. ",Many,More than 10,More than 10,N,N/A,2014,2014,January,February,Y,Y,Community,Biodiversity,Biodiversity,,,,"Species distribution, Biodiversity metric",≥ Two topics,"Avian diversity was significantly greater during breeding than during the winter period, although the most diverse parks during breeding were also the most diverse during winter. Most of the among–park variation in diversity was explained by park size, while tree density had a marginal contribution that was only significant during winter. Avian communities showed a significant nested subset pattern that was similar between seasons, with these patterns being mainly mediated by park size. Although the distribution of seven out of the 16 species occurring all–year–round changed significantly from one season to the other, the park ranks in the nestedness matrices were strongly correlated between seasons. This was caused by the reduction in the park distribution of some species from one season to the other that was compensated by the expansion of other species that were initially less common. ",Yes,Management,Management,,,"These results support the idea that, in small and medium–sized cities, park size is the main constraint on avian diversity, and the presence of relatively large parks (> 10 ha) should be encouraged to promote a rich avifauna all year round.",,RK
364026104,A160,Lindenmayer et al. (2010),"Lindenmayer DB, Knight EJ, Crane MJ, Montague-Drake R, Michael DR, MacGregor CI.",Australia ,What makes an effective restoration planting for woodland birds?,2010,Biological Conservation,Peer-Reviewed Journal,david.lindenmayer@anu.edu.au,N/A,Australia,Several,"""Our study region was the southern half of the South-west Slopes region of New South Wales, south-eastern Australia. It included the towns of Junee (0552952E 6140128N) in the north, Albury (0494981E 6008873N) in the south (a distance of approximately 150 km), and Gundagai (600532E 6119073N) and Howlong (467090E 6017897N) in the east and west, respectively (a distance of approximately 120 km).""",Southern,Several,Several,Multi-patch,"Land use type, Composition, Forested area","We surveyed 38, 45 and 62 plantings in 2002, 2004 and 2006, respectively, resulting in a total of 145 site-by-year observations. These plantings ranged from 2 to 20 years old and were a mix of locally endemic and non-local Australian ground cover, understorey and overstorey plant species. We measured context, configuration and content attributes of the plantings (see Table 1 for a full list and description).",Many,More than 10,More than 10,N,N/A,N/A,N/A,N/A,N/A,N/A,N,Community,Biodiversity,Biodiversity,,,,Biodiversity metric,Biodiversity metric,"""Our findings reinforce the concept that ‘‘the matrix matters” (Daily et al., 2003; Haynes et al., 2006; Lindenmayer and Fischer, 2006; Ricketts, 2001) and corroborates the importance of context effects reported in a wide range of ecosystems...""
""For example, we found that bird species richness was greater in plantings located in gullies and riparian areas than elsewhere in the landscape (Fig. 1,Table 2 ) – a result common with many other studies of a wide range of organisms (Huggett and Cheeseman, 2002).""
""We found a positive effect of the number of logs in a planting on bird species richness (Fig. 1,Table 2 ), and the probability of detection of Rufous Whistler (Fig. 2,Table 2 ).""
""We did not find that older plantings were more species rich than younger ones, as has been observed by other researchers in south-eastern Australia...""",Yes,"Management, Conservation",Management,Conservation,,"""We found that if an aim is to maximize overall species richness in plantings, there is value in targeting the location of new plantings by building on vegetation assets that are already there. For example, locating plantings in riparian areas and establishing plantings in places with pre-existing areas of remnant or planted native vegetation.""
""In the case of the Rufous Whistler, our data suggest that there will be value in establishing plantings: (1) with a high density of stems, (2) with numerous logs, and (3) located near other plantings (Fig. 2). For the White-browed Woodswallow, we found it is important to establish plantings around existing paddock trees and to not remove dead shrubs from plantings (Fig. 2).""
""We found evidence of the importance of retaining existing large paddock trees within plantings (e.g. for the White-plumed Honeyeater and the White-browed Woodswallow [Fig. 2]).""
",,KHT
364026106,A161,Smith (2003),Smith PGR.,Canada,Winter Bird Use of Urban and Rural Habitats in Ontario.,2003,Canadian Field Naturalist,Peer-Reviewed Journal,N/A,N/A,Canada,N/A,The study plots reflect different habitat categories in urban and rural southern Ontario andwereclassified intosevencategorie s—three ruralandurban categories,Northern,N/A,N/A,Multi-patch,Land use type,"Thirty-threeplotsreflect arange ofurban habitat categoriesincluding urban andsuburban residential, commercialandurban natural areasincluding parks, urbanopenspace,woodla ndsandother natural or semi-natural areas within cities and towns.",Many,More than 10,More than 10,N,N/A,N/A,N/A,N/A,N/A,N/A,N,Individual,Biodiversity,Biodiversity,,,,Abundance,Abundance,"""Urban natural areas,forests and mixed habitats showedthehighestaviandiversity whilecityandfarm showedthelowestdiversity(Table2).Larger urban natural areas(>10ha)haddiversityindices 5-19% higher thanforests.""
""City areas supported half as many species and about 70%thelevelsofSimpson’sdiversityindex, N2,as forests.""
""Diversity was higher in forest,rural mixed habitats andurban natural areas compared with cities and farms.""
""In this study, smaller birds (<20g)favored forests, mixed rural habitats and urban natural areas.Larger birds, 20-100 ginsize, were prevalent in cities and on farms. Marzluffetal. (1998) speculated that urbanization likely favours ground foraging birdspecies and discourages canopy and bark foragers.""
""Variation in theabundance ofsmall, insectivorous, upper andlowercanopyandforest birdspecies was one of the major sources ofvariance in this study.""
",No,N/A,N/A,,,N/A,,KHT
364026121,A162,Paker et al. (2014),"Paker Y, Yom-Tov Y, Alon-Mozes T, Barnea A.",Israel,"The effect of plant richness and urban garden structure on bird species richness, diversity and community structure.",2014,Landscape and Urban Planning,Peer-Reviewed Journal,yairpk@gmail.com,N/A,Israel,Tel Aviv,"We investigated bird communities in 25 public gardens in the cities of Tel-Aviv and nearby Holon, Israel (highest point above sea level is 62 m).",Northern,32◦02′,34◦47′,Patch,"Composition, Native species, Exotic/invasive species, Land use type","Vegetation structure was evaluated around each point count, at half circular plots, within a radius of 50 m from the observer. Trees and shrubs species were counted in each plot and we also recorded whether they were natives or aliens. Height of plants was divided into three groups: low (under 1.5 m), medium (1.6–5 m), and high (above 5 m). Annual plants were excluded. Trees, shrubs and lawn coverage were calculated using aerial photos in ArcView 9.3.",Many,More than 10,More than 10,N,N/A,2008,2009,January,May,Y,N,Individual,Biodiversity,Biodiversity,,,,Biodiversity metric,Biodiversity metric,"""However, we found that bird species richness was not affected by any of the 14 environmental variables that we tested. This outcome might indicate that in the Israeli urban environment birds can be less selective in their choice of habitat and therefore occupy any available greenspace.""
""Our results indicate that a diverse garden, composed of many shrub and tree species and a diverse spatial structure is attractive to many bird species.""
""In the light of this, our finding that native birds are attracted to native trees while alien ones are attracted to alien trees is of considerable importance to garden planners. It indicates that garden planners should prefer local trees over aliens in spite of the often more impressive appearance (greater height and extensive foliage) of the latter.""

",Yes,Management,Management,,,"""Therefore, we recommend avoiding large open lawns without trees or shrubs, as well as dense monoculture woods, because these components support only few bird species, and moreover – mostly aliens, like the Common Myna (Acridotheres tristis), or urban exploiters, like the Feral Pigeon (Columba livia). Instead, our recommendation is to plant many trees and shrub species, and to balance between open lawn space and close shrubberies or small thickets. As evident from Fig. 2, such diverse gardens support more bird species, and therefore can contribute to the enjoyment that people can get from visiting gardens in their neighborhood.""
""Accordingly, we recommend that when planning new gardens, designers will avoid large open lawns and dense monoculture woods without undergrowth, because these environments are favorable only for some urban exploiters and alien bird species. Instead, we recommend that an urban garden will consist of diverse shrubs and trees species.""
""On the other hand, we recommend reducing the proportion of alien trees, because they provide high habitats and food (big flowers with much nectar) that the larger alien birds need.""
",,KHT
364026137,A163,Narango (2018),Narango DL.,USA,Nonnative plants reduce population growth of an insectivorous bird.,2018,Proceedings of the National Academy of Sciences,Peer-Reviewed Journal,dnarango@gmail.com.,N/A,USA,Washington D.C,"Within Neighborhood Nestwatch, a citizen science program that monitors breeding birds in residential yards across the Washington, DC, metropolitan area (ref. 31 and SI Appendix, Fig. S1).",Northern,N/A,N/A,Patch,"Exotic/invasive species, Native species","Because birds operate at a patch rather than a yard scale (20), each “site” was composed of a focal yard that contained a chickadee nest box as well as a 50-m radius (0.79 Ha) area around the center of the yard that contained other properties. A 50-m radius was chosen because this area is approximately the territory size of breeding chickadees (32). Sites were separated by at least 1 km, located within a residential landscape, and no sites were located within publicly owned parkland.",One,Carolina chickadees,Poecile carolinensis,N,N/A,2013,2014,May,June,Y,N,Individual,"Survival, Breeding, Resources",Survival,Breeding,Resources,,"Micro breeding, Nesting survival, Foraging/Movement",≥ Three topics,"""Until recently, urban habitat restoration has operated on the premise that all green spaces, including residential landscapes and city parks, are ecologically equivalent, despite a poor understanding of the features determining whether a space functions as a source or sink for resident species (19). Our results identify the evolutionary origin of the plants used in urban landscaping as a key factor in determining the ecological viability of such landscapes.""
""Our study challenges this notion; our residential plant communities contained >200 different nonnative woody plant species, far exceeding that found in local natural areas, yet their evolutionary novelty created a trophic dead end for insectivorous consumers. Our work demonstrates that even a common “urban-adapted” bird species is food-limited when nonnative plants dominate landscapes and suggests that food limitation may be even more pronounced for bird species that have more specialized diets than chickadees.""
""These results add to the growing body of evidence that native plants are essential for providing ecosystem services and resources for wildlife in human-modified landscapes (9, 24–26). Nevertheless, even within sites with predominately native plant communities, we found substantial variation in potential population growth of chickadees.""
""Our study suggests that, from an ecological perspective, nonnative plants should only be promoted when there is the net ecological benefit from the addition of these plants to the landscape.""",Yes,Management,Management,,,"""If species are eliminated from urban areas because they are intolerant of nonnative plants and concomitant declines in prey abundance, our recommendation for <30% nonnative plant biomass in landscape designs may represent a maximum limit for sustaining avian insectivores in these landscapes.""",,KHT
364026157,A164,Shriver et al. (2020),"Shriver WG, Ladin ZS, Buler J, D’Amico V.",USA,Non-native shrubs and calcium availability are important for birds breeding in urban forests.,2020,Urban Ecosystems,Peer-Reviewed Journal,gshriver@udel.edu,N/A,USA,Delaware/Pennsylvannia,"""We randomly selected 30 study sites within 22 discrete forest patches in northern Delaware and Southern Pennsylvania (Fig. 1, Ladin et al. 2016a).""",Northern,N/A,N/A,Multi-patch,"Exotic/invasive species, Native species, Composition","Within each site, we sampled; soil to estimate exchangeable calcium, litter volume, shrub density, tree basal area, and coarse woody debris (cwd).",Many,"Carolina chickadees,
Carolina wren,
Eastern Towhee,
Gray catbird,
Wood thrush","Poecile carolinensis,
Thyrothorus ludovicianus,
Pipilo erythrophthalmus,
Dumtella carolensis,
Hylocichla mustelina",N,N/A,2010,2012,May,July,Y,N,Community,"Biodiversity, Breeding",Biodiversity,Breeding,,,"Meso breeding, Abundance",≥ Two topics,"""We found that relationships among species’ territory density were driven by local-scale effects rather than landscape-scale effects, with non-native shrub cover and Ca rich prey the primary drivers. These findings provide an increased appreciation for the complex role of non-native invasive plants within urbanized landscapes, and an improved understanding for how local-scale conservation efforts may benefit breeding bird populations more generally.""
""Therefore, non-native shrubs, which are dominated by multi-flora rose, are providing the majority of the vegetation structure in the height strata where these species construct nests.""",No,N/A,N/A,,,N/A,,KHT
364026968,A165,Galeotti (1994),Galeotti P,Italy,Patterns of territory size and defence level in rural and urban tawny owl (Strix aluco) populations,1994,Journal of Zoology,Peer-Reviewed Journal,N/A,N/A,Italy,Pavia,"City of Pavia, Northern Italy",Northern,N/A,N/A,Multi-patch,"Land use type, Fragmentation","% Natural vegetation, %Poplar Groves, %Parks, %Vegetable gardens, Fragmentation",One,Tawny owl,Strix aluco,N,N/A,1986,1992,N/A,N/A,Y,Y,Population,Behaviour,Behaviour,,,,Population changes,Population changes,"Defence level of urban territories was affected by 'social’variables (nearest neighbour distance and years of occupancy), structural variables (percentage of poplar grove and diversity), and food supply, while in rural territories only structural variables (fragmentation or natural vegetation) and food supplies affected defence level.",No,N/A,N/A,,,N/A,,RK
364026234,A166,Woongsoon et al. (2019),"Woongsoon Jang, Ara Seol, Ok-Sik Chung, Junghee Sagong, Jong Koo Lee.",Canada,"Avian Reporting Rates in Chugcheongnam Province, South Korea Depend on Distance from Forest Edge, Size of Trees, and Size of Forest Fragments.",2019,Forests,Peer-Reviewed Journal,woongsoon.jang@gmail.com,N/A,South Korea,Chungcheongnam,"The study was conducted in the Province of Chungcheongnam, located in the western part of South Korea",Northern,35 00',126 13',Multi-patch,"Composition, Forested area","The study utilized the Korea Forest Cover Type Map’s tree size classification and forest types. The size classes were classified with the median diameter at breast height (DBH) of trees in the stand: (a) <6 cm, size class 0; (b) 6–18 cm, size class 1; (c) 18–30 cm, size class 2; and (d) >30 cm, size class 3. The forest types were classified into coniferous, deciduous, and mixed forests. Other minor forests types (e.g., bamboo forest) were excluded due to no sampling data (Table 1). These variables were used as explanatory",Many,More than 10,More than 10,N,N/A,2005,2011,N/A,N/A,Y,N,Community,Biodiversity,Biodiversity,,,,Biodiversity metric,Biodiversity metric,"However, the results of this study were unexpected in that forests patches with larger areas tended to have lower species diversity. Presumably, this can be attributed to the fact that forest sizes across the study region had been fragmented for a long time, rendering the average forest size quite small (Table 1). In this study, the positive relationship between tree size and avian diversity and abundance also reveals an optimistic view. Large trees are essential to some species, especially for cavity-nesting birds such as woodpeckers [51–53]. In this study, several bird species showed notable trends of occurrence when related to forest size and distance to forest edge. If this study classified a species showing negative associations with forest size and/or distance to forest edge as a forest-edge species, then the forest-edge species were more distinctly and abundantly identified than the forest-interior species.",Yes,Conservation,Conservation,,,"Furthermore, due to regional reforestation about 40 years ago [40], the composition and structure of the forests in this study region might be relatively simple and homogeneous [50]. As a result, even a large-sized forest in this region might provide less diverse habitats and resources. As a conservation implication, the establishment of strategies to increase bird species diversity should not only take into account forest patch size but also habitat heterogeneity.",,KHT
364026482,A167,Zivanovic & Luck (2016),"Zivanovic AJ, Luck GW",Australia ,"Social and environmental factors drive variation in plant and bird communities across urban greenspace in Sydney, Australia",2016,Journal of Environmental Management,Peer-Reviewed Journal,ashlea@mail.org,N/A,Australia,Sydney,"30 city park sites in Sydney, Australia",Southern,N/A,N/A,Patch,"Forested area, Composition, Diversity metric","At the site scale, bird species richness and abundance were modelled against four environmental predictors. These included site size, topography and site plant species richness; however, mean leaf size was modelled only against bird species richness, whereas percent concrete ground cover was modelled only against bird abundance.",Many,More than 10,More than 10,N,N/A,2013,2013,N/A,N/A,N,Y,Community,Biodiversity,Biodiversity,,,,"Biodiversity metric, Abundance",≥ Two topics,"Bird species richness within greenspaces increased with increasing distance from the central business district and decreasing distance from freshwater. Bird abundance was best explained by a combination of social–ecological factors, with abundance increasing with increasing site (greenspace) age, increasing percent concrete groundcover of a site and increasing proximity to the central business district. ",Yes,Management,Management,,,"Co-management arrangements between local citizen groups and councils appeared to have a strong influence on the plant communities of particular city park sites, increasing species richness and abundance. This is a very important consideration for future management of urban greenspaces that aim to improve both human and environmental health outcomes – given recent evidence that ecologically diverse UGS may improve the psychological well-being of greenspace users (Carrus et al., 2015, Fuller et al., 2007) (but see Dallimer et al., 2012, Konijnendijk et al., 2013, Luck et al., 2011).

Given the scarcity of the ‘rare parks’ identified in our study, councils should implement policies that protect not only their biodiversity, but also their cumulative ecological qualities (inclusive of ‘exotic’ vegetation) until further investigation into how varying ecological characteristics influence park user well-being can be carried out.",,RK
364026252,A168,Greco & Airola (2018),"Greco SE, Airola DA.",USA,"The importance of native valley oaks (Quercus lobata) as stopover habitat for migratory songbirds in urban Sacramento, California, USA. ",2018,Urban Forestry & Urban Greening,Peer-Reviewed Journal,segreco@ucdavis.edu,N/A,USA,Sacramento,"The study area was the Curtis Park neighborhood (“Curtis Park”)a 259 ha neighborhood in Sacramento, California, USA (Fig. 1) with a 2015 census population of about 5200.",Northern,N/A,N/A,Patch,"Canopy Cover, Composition, Land use type","A photographic image (dated October 30, 2011) of the Curtis Park study area was obtained from Google Earth (accessed September 12, 2012) and georeferenced in ArcGIS using four control points, resulting in a 2.1 m RMSE (root mean square error).",Many,More than 10,More than 10,N,N/A,2011,2012,April,October,Y,N,Community,"Behaviour, Biodiversity",Behaviour,Biodiversity,,,"Abundance, Foraging/Movement",≥ Two topics,"Our results clearly demonstrate that higher abundance of Neotropical migrant songbirds occur in areas of the urban forest in Curtis Park, Sacramento, California that support greater canopy cover of the native valley oak. Our results also show the mechanism for this attraction − strong selection of valley oak during foraging by migrants. From a regional perspective, our study clearly shows that native valley oak trees in an urban area can support substantial numbers of migratory birds.",No,N/A,N/A,,,N/A,,KHT
