879386296,F112,Wood and Dupras (2021),"Wood SLR, Dupras J. Increasing functional diversity of the urban canopy for climate resilience: Potential tradeoffs with ecosystem services? Urban Forestry & Urban Greening. 2021;58:126972. ","Wood SLR, Dupras J.",Canada,Increasing functional diversity of the urban canopy for climate resilience: Potential tradeoffs with ecosystem services?,2021,Urban Forestry & Urban Greening,Peer-Reviewed Article,sylvia.wood@eco2urb.com,N/A,Canada,Quebec ,"The city has a population of ~532,000 inhabitants and its landuse is characterizedby low-density urban structures with a number of large highways and green spaces cutting across the city.",Northern,52° 53' 60'',73° 30' 0'' ,N,N/A,Multi-Patch,Composition,"For each stem in the inventory data was available on the species name, diameter at breast height (DBH), geo-location, estimated date of planting, whether it was a street tree, and if so, its relative placement, and a unique identifier. This data was used as the baseline dataset for further analysis.",Above-ground biomass,"We used the United States Forest Service UFORE urban tree model (i-Tree Eco v6, 2018) to estimate the provisioning of ecosystem services from the current municipal canopy and across runs for each of the three replanting scenarios.",2018,2018,N,Multi-patch,"Our scenarios suggest that service provisioning could change by +1.8 % to -66 % in the first10 years after arrival of EAB, depending on the service and the replanting approach adopted. On a per stem basis, conifers may provide a higher annual level of service provisioning than deciduous species in temperate climates as they keep their needles year-round",Y,Management,Management,N/A,N/A,"We find that improving the functional diversity of municipal street trees and parkland trees in Quebec City, with an eye to improving climate-tolerance of the canopy, could have important near-term impacts on the delivery of ecosystem services. Overall, replacing ash trees lost to EAB with coniferous species provided the greatest recovery in provisioning of many ecosystem services. Adopting a stratified replanting approach across functional groups was most effective in increasing the spatial diversity of trees and reducing vulnerability to pests, while still maintaining higher levels of service provisioning than a business-as-usual approach.",,KHT
879386299,F113,Mexia et al. (2018),"Mexia T, Vieira J, Príncipe A, Anjos A, Silva P, Lopes N, et al. Ecosystem services: Urban parks under a magnifying glass. Environmental Research. 2018;160:469–78. ","Mexia T, Vieira J, Príncipe A, Anjos A, Silva P, Lopes N, et al.",Portugal,Ecosystem services: Urban parks under a magnifying glass.,2018,Environmental Research,Peer-Reviewed Article,teresa.mexia@gmail.com ,N/A,Almada,Portugal,"The study area was an urban park (“Parque da Paz”) with approx. 44 ha located in the city of Almada, Portugal.",Northern,38°9.771′,9°9.828′W,N,N/A,Patch,Composition,Land-cover characterization of the park (see Fig. 1) was based on the general municipality cartography of the park. ,"Below-ground biomass, Above-ground biomass",Above and below-ground woody species’ dry-weight biomass was calculated using allometric equations from the literature.,N/A,N/A,N,Patch,"The park's total carbon stock was 4040Mg, with a greater contribution from areas with the highest tree density (forest and grassland with high tree density). When all services were standardized and integrated, it was evident that the mixed forest area had the maximum total supply of all tested ES and carbon stock was clearly dependent on tree density,",N,N/A,N/A,N/A,N/A,N/A,,KHT
879386275,F114,Gomez-Villarino et al. (2021),"Gómez-Villarino MT, Gómez Villarino M, Ruiz-Garcia L. Implementation of Urban Green Infrastructures in Peri-Urban Areas: A Case Study of Climate Change Mitigation in Madrid. Agronomy. Multidisciplinary Digital Publishing Institute; 2021;11:31.","Gómez-Villarino MT, Gómez Villarino M, Ruiz-Garcia L. ",Spain,Implementation of Urban Green Infrastructures in Peri-Urban Areas: A Case Study of Climate Change Mitigation in Madrid. ,2021,Agronomy,Peer-Reviewed Article,teresa.gomez.villarino@upm.es,N/A,Spain,Madrid,"The study area is located in the peri-urban area of the city of Madrid, covering 200 hectares distributed on both banks of the Manzanares River (Figure 1). Madrid is the capital of Spain, a country in the south of Europe. Madrid has 6.642 million people, occupies 604 square kilometers, and is divided into 21 districts. The Manzanares River crosses the city of Madrid from the northwest to the south, along a 30 km stretch.",Northern,N/A,N/A,N,N/A,Multi-Patch,"Native species, Composition, Land use type","The Manzanares restoration project includes different actions with the objective of increasing urban resilience and sustainability: (i) restoration of the riverbank forest; (ii) demonstration of urban biomass production; (iii) creation of a forest park mainly with native tree, bush, and shrub species representative of Madrid habitats; (iv) creation of a didactic area for fruticulture; (v) establishment of urban edible gardens with native horticultural varieties from Madrid, and (vi) establishment of a cereal area for landscaping, cultural, and educational purposes. Description of these actions are shown in Table 1.",Above-ground biomass,"Calculation of CO2-eq absorption and biocapacity of the different interventions. The annual CO2 capture rate by urban forestry action has been calculated based on a methodology of the Spanish Ministry of Agriculture, Food, and Environment [37]. This methodology calculates the CO2-eq absorptions of new forest plantations in line with the Intergovernmental Panel on Climate Change guidelines and good practice guidance.ific species. According to this guide, the estimated absorptions of the species selected in the project vary between 0.05 and 1.3 t CO2/specimen over a 40-year horizon.",N/A,N/A,N,Patch,"Figure 3 illustrates two additional results. The first one is the different behavior between agricultural and forestry actions. Biocapacity of herbaceous species is lower than that of forest species. This is because agricultural species are herbaceous, and therefore have a lower aerial and subterranean biomass, and are harvested periodically. Consequently, the effectiveness of urban agriculture action in the storage of carbon per hectare is lower than that of any of the other forestry actions. Nevertheless, as long as growth is high, agricultural crops are carbon sinks and, therefore, urban agriculture is, much like tree plantations, an effective mechanism to mitigate the increase of atmospheric CO2 [38]. Secondly, the figure also shows that reforestation of natural areas is more effective in storing carbon than parks, tree cultivation, or other urban green areas.",Y,"Restoration, Management",Restoration,Management,N/A,"The implementation of any type of UGI in the city is positive from a climate change mitigation standpoint, but its effectiveness will depend on the chosen typology. Taking advantage of degraded areas that often characterize the surroundings of the city to recover natural spaces, such as riverbanks or native forests, or to recover and enhance agricultural activity, is a good option for counteracting urban warming and contributing to urban sustainability.",,DMR
879386325,F115,Gratani and Varone (2013),"Gratani L, Varone L. Carbon sequestration and noise attenuation provided by hedges in Rome: the contribution of hedge traits in decreasing pollution levels. Atmospheric Pollution Research. 2013;4:315–22.","Gratani L, Varone L.",Italy,Carbon sequestration and noise attenuation provided by hedges in Rome: the contribution of hedge traits in decreasing pollution levels. ,2013,Atmospheric Pollution Research,Peer-Reviewed Article,loretta.gratani@uniroma1.it,N/A,Italy,Rome,The study was carried out in the city of Rome in the period January–July 2011 in order to analyze variations in CO2 concentration and noise level in relation to traffic density.,Northern,N/A,N/A,N,N/A,Patch,Composition,"The most representative species traditionally used for hedges in Rome  [Laurus nobilis  L, Nerium  oleander  L,  Pittosporum  tobira (Thunb.)  Aiton,  and Pyracantha coccinea M.  Roem.]  were  analyzed. ",Above-ground biomass,"The total photosynthesisperhedge(TP,μmolCO2m–2s–1)wascalculatedby multiplying TLA by the mean maximum PN rates for each sampling occasion, according to Gratani and Varone (2006). The monthly CO2 sequestration (MSC, μmol CO2 month–1) per each hedge type was calculated multiplying TP by the total photosynthetic activity time(inhours)permonth,accordingtoGrataniandVarone(2006). The yearly CO2 sequestration per each hedge type was also calculated.",2011,2011,N,Individual,"Among the considered species, P. tobira and L.nobilis had the highest MCS (31.6±2.8 and 25.4±2.4 Kg CO2 month–1, respectively),  followed by N. oleander (17.3±2.4 Kg CO2 month–1) and P. coccinea  (11.8±0.6 Kg CO2 month–1). The total yearly  sequestration capacity  was 142, 208, 305 and 379, kg CO2 y–1 in P. coccinea, N. oleander, L.  nobilis and P. tobira, respectively.  Our  results  on  the  whole  underline that the considered hedges have a different CO2 sequestration and noise attenuation capability as related to the species and hedge leaf traits, becoming  important  elements  in  urban  greening. ",Y,Management,Management,N/A,N/A,"Moreover, according to FangandLing(2003), the use of hedges planted under trees in the high traffic avenues of a city seems to be the best solution to decrease noise and CO2 concentration. Plant species should be selected considering pollution reduction effects in addition to their ecological and aesthetical features (Booth, 1991) and all their characteristics which are suitable for the specific environmental conditions(Malekietal.,2010). Moreover, it is important to consider that the hedges under study, being evergreen, are active also in winter when traffic peaks. Among the considered hedge types, L. nobilis and P. tobira are the most efficient in both carbon dioxide sequestration and noise attenuation capability, considering also that they have a greater tolerance to severe pruning and a large ability to maintain high shootdensityandbasalfoliage.",,DMR
879386332,F116,Zhao et al. (2010),"Zhao M, Kong Z, Escobedo FJ, Gao J. Impacts of urban forests on offsetting carbon emissions from industrial energy use in Hangzhou, China. Journal of Environmental Management. 2010;91:807–13.","Zhao M, Kong Z, Escobedo FJ, Gao J. ",China,"Impacts of urban forests on offsetting carbon emissions from industrial energy use in Hangzhou, China. ",2010,Journal of Environmental Management,Peer-Reviewed Article,zhaomin@shnu.edu.cn,N/A,China,Hangzhou,"This study was conducted in Hangzhou, which lies in eastern China (302505300 North, 1201608900 East) along the Yangtze River Delta Region (Fig. 1). The Hangzhou region contains the Hangzhou metropolitan area, surrounding cities, districts and counties. The total study area is 16,900 km2 and the topography of the region is characterized by hills that cover about 73% of the study area. The urban forest cover in the study area is approximately 54.6% of the total land area.",Northern,N/A,N/A,N,N/A,Multi-Patch,Composition,"A forest inventory was carried out for the entire region of Hanghzou including the urban area during 1991–1996, following methods and standards developed by the Chinese Ministry of Forestry (Zhao and Zhou, 2005). The age classes used for the inventory are based on national guidelines for forest resource surveys (Table 1)(MOF, 1982). 1 represents Pinus massoniana and other tropical pine forests, 2 is Cunnighamia lanceolata forest, 3 is evergreen broadleaf forest, and 4 is bamboo forest).",Above-ground biomass,"Dry-weight biomass for the different urban forest types was calculated using a series of volume-derived biomass equations (Zhao and Zhou, 2005, 2006; Pan et al., 2004)(Table 2). Carbon storage for urban forests was calculated by multiplying tree dryweight biomass by 0.5 (Zhao and Zhou, 2006). Carbon sequestration is the annual ratio of C fixation in Net Primary Production (NPP).",1991,1996,N,Patch,"Estimated urban forest C storage in Hangzhou was approximately 11.74 Tg C (1 Tg ¼ 1012 g) (Table 3), and varied for different forest types and different age classes (Table 4). For example, carbon storage for P. massoniana and other tropical pines, C. lanceolata forest, and evergreen broad-leaved forest was about 3.29 Tg C, 4.21 Tg C, and 1.90 Tg C, respectively. Table 3 shows that average C storage per ha (i.e. carbon density) by Hangzhou’s urban forests was estimated at 30.25 t C/ha, and varied from 18.22 t C/ha for the P. massoniana and other tropical pine type to 35.87 t C/ha for Bamboo forests. Mean C sequestration for C. lanceolata forests was 0.49 t C/ ha/yr, whereas it was 3.06 t C/ha/yr in the broad-leaved evergreen forest type.",Y,Management,Management,N/A,N/A,"n Hangzhou’s subtropical climate, subtropical evergreen broad-leaves are most common. Hence, selecting the proper native evergreen species should improve urban forest carbon storage in Hangzhou. At the same time, improving urban forest biodiversity and urban forest ayers (including grasses, shrubs, and trees) is also an important management practice for improving carbon storage (Iverson et al., 2008). Planting long-lived, low maintenance species in energy-conserving locations (Jo, 2002; Nowak et al., 2002) and minimizing fossil fuel use related to management and maintenance activities (Nowak et al., 2002) will maximize the carbon dioxide offset benefits of urban forests.",,DMR
879386352,F117,Gratani and Varone (2007),"Gratani L, Varone L. Plant crown traits and carbon sequestration capability by Platanus hybrida Brot. in Rome. Landscape and Urban Planning. 2007;81:282–6.","Gratani L, Varone L. ",Italy,Plant crown traits and carbon sequestration capability by Platanus hybrida Brot. in Rome. ,2007,Landscape and Urban Planning,Peer-Reviewed Article,loretta.gratani@uniroma1.it,N/A,Italy,Rome,"The study was carried out in the city of Rome (41◦53′N, 12◦29′E), which was under Mediterranean type climate. The average total yearly rainfall was 695 mm, the average minimum air temperature of the coldest month (February) was 5.6 ± 1.9 ◦C and the average maximum air temperature of the hottest months (July and August) was 30.8 ± 1.0 ◦C",Northern,41 53' N,12 29' E,N,N/A,Multi-Patch,"Land use type, Individual tree management","Plant structure was analysed for five plants of P. hybrida of comparable sizes at each P and C site, for a total of 50 trees at the P sites and 40 trees at the C ones. Tree diameter at breast height (dbh, cm) was measured by a wheel. Plant (H, m) and crown (h, m) height were measured by a clinometer; the height of the crown was calculated as the difference between plant height and the insertion point of the first coppers.",Above-ground biomass,"The total yearly CO2 sequestration capacity for P. hybrida was calculated by multiplying the photosynthetic rate of the crown (TPCR, mol CO2 s−1) by the total photosynthetic activity hours in the year (PTYH). PTYH was obtained by summing the hours in the year with positive PN; TPCR was obtained by multiplying SPT by the mean yearly photosynthetic rate (YPR, mol CO2 m−2 s−1), according to Gratani and Varone (2006).",2005,2005,Y,Patch,"CO2 sequestration was 108 ± 5 and 126 ± 2 kg year−1 of CO2 at P and C sites, respectively.",Y,Management,Management,N/A,N/A,"Thus, the choice of plant species for urban areas may be set out favouring those species which characterise the natural environment, but taking into account their own air amelioration capability. Plant traits of each species may be used for urban inventory available for urban tree planting programs to ameliorate urban air pollution.",,DMR
879386355,F118,Fu et al. (2019),"Fu D, Bu B, Wu J, Singh RP. Investigation on the carbon sequestration capacity of vegetation along a heavy traffic load expressway. Journal of Environmental Management. 2019;241:549–57. ","Fu D, Bu B, Wu J, Singh RP.",China,Investigation on the carbon sequestration capacity of vegetation along a heavy traffic load expressway.,2019,Journal of Environmental Management,Peer-Reviewed Article,rajupsc@seu.edu.cn,N/A,China,Shanghai-Nanjing,"The Shanghai-Nanjing G42 expressway in eastern China with a total length of 274 km was selected for the current study. This expressway is the one of the busiest expressways in China with a carrying capacity of more than 60,000 vehicles per day.",Northern,N/A,N/A,N,N/A,Region,Composition,"Vegetation along this expressway was divided into three categories, including trees, shrubs and herbs. Vegetation was mostly distributed along the road, with a small part concentrated in the toll booth station area, service area and management office. The vegetation outside the expressway isolation column was not included in the statistics.",Above-ground biomass,Assimilation method was used for the calculation of the carbon sequestration of trees and shrubs. The flow chart of carbon sequestration calculation by assimilation method is presented in Fig. 3(b). The net assimilation per plant leaf area per day can be obtained by measuring the net photosynthesis rate per leaf area of the plant.,N/A,N/A,N,Individual,"A total of 199 tree and 293 shrub species were investigated in the current study. Results reveal that the carbon sequestration capacity of trees, shrubs and herbs was 74.87%, 24.96%, and 0.17%. The annual carbon sequestration of trees was approximately 73,160 tons, while the annual carbon sequestration of shrubs was approximately 24,389 tons. It indicated that the trees could be divided into three categories based on carbon sequestration capacity of different plants in unit land area. The first category was the tree species with γ value greater than 70 kg m−2·a−1, only included Koelreuteria paniculate. The second category was tree species with γ value between 16.04 and 37.64 kg m−2·a−1, including Ligustrum lucidum, Cinnamomum camphora, Lagerstroemia indica, etc. The remaining 11 species could be combined as the third category with γ value between 1.5 and 10.26 kg m−2·a−1. Tables including species (trees/shrubs) and their carbon capacity.",Y,Management,Management,N/A,N/A,"(1) Planting the tree or shrub species with strong carbon sequestration capacity during the process of construction and conservation under the premise of rich tree species preservation. Although some plant varieties had obvious advantages in carbon sequestration, we cannot use a single variety of plants, reasonable combinations to enhance plant species richness need to be made. In terms of trees, the newly constructed expressway should increase the proportion of the first and second types of trees, such as: Koelreuteria paniculate, Ligustrum lucidu, Cinnamomum camphora, Lagerstroemia indica, etc. It is also preferable to use these tree species for replanting in the management and maintenance operation of the completed expressway. At the same time, these strategies were equally applicable to the greening of urban roads.
(2) Making full use of space in vertical manner to realize the community structure of ""herbs + shrubs + trees"" from bottom to top to maximize the use of limited land space. In the construction design stage, plant growth should be fully considered. The excessive density of plants is not conducive to the improvement of carbon sequestration capacity.",Strong recommendations,KHT
879386363,F119,Saini (2017),Saini D. Screening and evaluation of candidate trees for terrestrial carbon storage in regions with high air pollution and water stress. Carbon Management. Taylor & Francis; 2017;8:445–56.,Saini D. ,United States of America,Screening and evaluation of candidate trees for terrestrial carbon storage in regions with high air pollution and water stress. ,2017,Carbon Management,Peer-Reviewed Article,dsaini@csub.edu,N/A,United States of America,N/A,"However, more than 90% of the tree species in Southern California’s urban forests are non-native and exotic [8], and some species even originate from tropical environments, requiring substantial irrigation [114]. Now, researchers are aiming to study the benefits of historic ornamentals, the drought-tolerant trees of the future, and native California species in order to identify urban trees that can survive in a warmer, drier Southern California, and that would require a lower amount of water [114].",Northern,N/A,N/A,N,N/A,Region,"Composition, Native species","The first step involved the identification of trees that are native to California, drought-resistant and long living (> 50 years). Table 1 provides a list of 37 trees that are native to California, drought-resistant, and long lived (40–150 years). This list was prepared using the ‘SelecTree’, a tree selection database maintained by the Urban Forest Ecosystems Institute at California Polytechnic State University, San Luis Obispo [115].",Above-ground biomass,"Finally, the National Tree Benefit Calculator developed by Casey Trees and Davey Tree Expert Co. [118] was used in order to obtain more robust estimates of atmospheric carbon (in terms of CO2) removed by each of the top candidate tree species. The calculator requires the tree’s diameter and the land-use type in the tree’s vicinity as input data in order to calculate the overall benefits, including air quality and amounts of CO2 removed from atmosphere.",N/A,N/A,N,Individual,"Based on the four criteria discussed above, this list of the 37 trees that were initially identified was further reduced to 12 (Table 2). From these 12 short-listed trees. Based on the above-mentioned distinct features and characteristics, seven trees – the mountain ironwood, the California ash, the desert willow, the tecate cypress, the blue palo verde, the little leaf palo verde and the smoke tree (Figure 2) – were determined to be the top candidates for future large-scale terrestrial carbon storage projects. (Table 3)",Y,"Management, Restoration",Management,Restoration,N/A,"Based on the methodology used in this study, it is estimated that 753 km2 of new forest comprising the seven top candidate trees identified in this study will be able to offset 482,000 T CO2e (0.48 MMT CO2e) GHG emissions per year resulting from non-point sources within 10 years of forestation, which is equivalent to the emissions offset by a large-scale integrated carbon capture and storage project LSIP.",,DMR
879386365,F120,Whittinghill et al. (2014),"Whittinghill LJ, Rowe DB, Schutzki R, Cregg BM. Quantifying carbon sequestration of various green roof and ornamental landscape systems. Landscape and Urban Planning. 2014;123:41–8. ","Whittinghill LJ, Rowe DB, Schutzki R, Cregg BM.",United States of America,Quantifying carbon sequestration of various green roof and ornamental landscape systems.,2014,Landscape and Urban Planning,Peer-Reviewed Article,lw2507@columbia.edu,N/A,United States of America,East Lansing,"This study examined the carbon content of thirteen ornamental landscape systems of varying complexity over the course of three years at the Michigan State University Horticulture Teaching and Research Center (HTRC) in East Lansing, MI.",Northern,N/A,N/A,N,N/A,Patch,Composition,"The landscape systems examined at ground level included (1) Kentucky bluegrass lawn, (2) native prairie mix, (3) succulent rock garden consisting of Sedum, (4) woody ground covers, (5) herbaceous perennials and grasses, (6) deciduous shrubs, (7) broad-leaf evergreen shrubs, (8) narrow-leaf evergreen shrubs, and (9) vegetable and herb garden.","Soil, Below-ground biomass, Above-ground biomass","Above-ground biomass in the herbaceous perennial and grasses, deciduous, broad-leaf evergreen, and narrow-leaf evergreen shrubs, and ornamental green roofs were estimated from plant dimensions based on allometric equations developed from destructive sub-sampling in a companion study.",2010,2011,N,Individual,"Broad-leaf evergreen shrubs, deciduous shrubs, and the ornamental green roof landscape systems did, however, have the lowest below-ground carbon contents during both growing seasons (0.10, 0.14, and 0.18 kg m−2 in 2011, respectively). All results for above-ground carbon content are presented in Table 4. The three shrub landscape systems, the herbaceous perennials and grasses and ornamental green roof had the highest amount of carbon in above ground biomass in both years followed by the native prairie mix. The landscape systems that were able to sequester the most carbon contained higher amounts of woody plant structures and higher plant biomass volumes, such as the three shrub landscape systems and the herbaceous perennial and grasses, native prairie mix, and ornamental green roof landscape systems.",N,N/A,N/A,N/A,N/A,N/A,,KHT
