Rayyan ID,Article ID (F_), In text citation,Full citation,Authors,Country of First Author,Title,Year,Journal,Publication Type*,Corresponding author email address,Supp,Study.Country,City,Geographical_region (study area),Hemisphere,"Latitude (DDD° MM' SS.S"")","Longitude (DDD° MM' SS.S"")",Field History Described? (Y or N),Description of Field History (e.g. land legacies),Urb.scale,Forest.comp,Description of Forest Component,Carbon.metric,Description of carbon metric,Year.start,Year.end,Comparator,"Scale of measurement (individual tree, patch, multi-patch)",Main Result,Rec.included,Rec,Rec1,Rec2,Rec3,Recommendations,Comments,Reviewer Initial
879385434,F1,Boyle and Lavkulich (1997),"Boyle CA, Lavkulich L. Carbon Pool Dynamics in the Lower Fraser Basin from 1827 to 1990. Environmental Management. 1997;21:443–55. ","Boyle CA, Lavkulich L",New Zealand,Carbon Pool Dynamics in the Lower Fraser Basin from 1827 to 1990,1997,Environmental Management,Peer-Reviewed Article,"Resource Management and Environmental Studies 436E 2206 East Mall University of British Columbia Vancouver, British Columbia V6T 1Z3, Canada",N/A,Canada,Vancouver to Hope,"The boundary of the area was selected to encompass the basin and the major towns and communities that comprise the Lower Mainland, excluding lands north of Lions Bay, Stave Lake, and Pitt Lake, ",Northern,N/A,N/A,Y,"A number of bogs and fens existed in the study area in 1827 (North and Teversham 1984) but were mined, diked, and converted to agricultural production by the beginning of this century. Prior to 1827, there was some burning of land near the coast to improve vegetation for berry growth, but there appears to have been no other agricultural activity (North and others 1979).",Region,Land use type,"Forests in the Lower Fraser Basin, Biomass in wetlands includes the living biomass as well as peat buildups in bogs and fens. The agricultural area defined by Boyle and others (1996) for the LFB included pasture, cropland, rural residences and other buildings, and small woodlots. Crops grown in the study area include grains, vegetable crops, berries (including cranberries), and fruit trees and include both perennial and annual vegetation as well as the annually harvested crop. A significant portion of biomass in an urban or suburban area lies in the trees, shrubs, and lawns lining streets and in urban parks and playgrounds. The amount of biomass in buildings includes wood.","Above-ground biomass, Infrastructure (timber buildings), Below-ground biomass","To determine the biomass in the forests of the LFB, data from Kimmins and others (1985) and Franklin and Waring (1979) were used to determine average biomass in stands 40 years or less, 41–120 years, and over 120 years old (Table 3). Root biomass was not usually given so it was calculated as 20% of the above story biomass (Grier and Logan 1977) and decay was estimated at 0.03 t/yr (Spies and others 1988).",1827,1990,N,Multi-patch,"The biomass contained in forests has dropped by more than half over the past 170 years and contains about 230 Mt of biomass today, a loss of 247 Mt of biomass from the forest (Figure 2). Prior to 1827, over 90% of the biomass had been contained in trees older than 120 years, but today only about 48% is in old trees. According to Boyle and others (1995a) these older trees, containing almost 50% of the biomass of the forest in the LFB, occupied only 19% of the forested area in the LFB. loss of carbon from this pool also indicates that the higher carbon uptake of younger trees does not compensate for the mass of carbon lost through logging the old-growth timber. Once mobilized, less than 10% of forest biomass enters another stable, terrestrial carbon pool. Most of it is converted to carbon dioxide. The two major biomass sinks in buildings and urban areas lie in vegetation and residential buildings. Overall, the amount of biomass in buildings and urban vegetation has increased by 9 Mt, (400%), the equivalent of 17 Mt of carbon dioxide.",Y,Management,Management,N/A,N/A,"However, it does indicate that land-use management should take the loss of carbon pools as a serious issue and provides one perspective from which to examine local versus global sustainability. The primary source of the released carbon was old-growth forest, which contains a higher biomass per hectare than tropical rain forest (Ryan 1994). This forest was a major pool of carbon, and the release of this contained carbon is not being reversed by current forest management practices since trees are cut at a younger age. Moreover, the loss of carbon from soils after deforestation is also not being reversed and the other Figure 8. Biomass carbon in the LFB prior to 1827, in 1930, and in 1990. Figure 9. Estimated net loss of carbon to the atmosphere for different pools in the LFB for 18271930 and large carbon accumulator, wetlands, requires up to 10,000 years to accumulate significant amounts of carbon.",,KHT
879385439,F2,Manolaki & Vogiatzakis (2017),"Manolaki P, Vogiatzakis IN. Ecosystem services in a peri-urban protected area in Cyprus: a rapid appraisal. NC. 2017;22:129–46. ","Manolaki P, Vogiatzakis IN.",Cyprus,Ecosystem services in a peri-urban protected area in Cyprus: a rapid appraisal,2017,Nature Conservation,Peer-Reviewed Article,ioannis.vogiatzakis@ouc.ac.cy,N/A,Cyprus,Larnaca,"Rizoelia National Forest Park, a peri-urban Natura 2000 site close to the city ",Northern,N/A,N/A,Y,"Suffered intense human related pressure over the years. Afforestation with non-native species, leisure activities and a dense road network which has led to a decrease in size of two priority habitats at the European level. ",Patch,"Composition, Forested area, Land use type","Habitat types: needleleaf plantation, broadleaf plantation, Sarcopoterium spinosum phrygana, Aborescent matorrals with Ziziphus, Pseudo-steppe with grasses and annuals. Generally included temperate scrub/woodland and temperate grassland.","Below-ground biomass, Above-ground biomass, Soil, Dead wood/organic matter","Total carbon stock was calculated by adding the carbon stocks of each habitat at the site [Above-Ground Biomass (C_ABG), Below-Grounf Biomass (C_BGB), Soil (C_Soil) and Dead organic matter (C-dead)]",N/A,N/A,N,Patch,"The most important habitat types were temperate scurb/woodland and temperate grassland. The most ES delivered by the study area refer to aesthetic benefits/inspiration, recreation/tourism,biodiversity, global climate regulation and environmental education. Despite considered of low biodiversity value, (Needle-leaf plantation, temperature scrub/woodland) have the highest capacity (compared to the natural and semi-natural habitats of the site) to provide ES and have high regulating service capacity. Within a peri-urban park, green areas and tree plantations can function as carbon sinks, althuogh. urban vegetation only sequestrated a small part of annual CO2 emissions of a city.",Y,Management,Management,N/A,N/A,Authorities should manage the area in the future in a way that maximizes the provision of high capacity ES (like regulating) which is facilitated by the appraisal of the area's potential. What is equally important in terms of management is shifting from soley biodiversity delivery to ES delivery and the need to identify tradeoffs between ES. Study highlights the importance of site-based assessment for ecosystem services delivered in protected areas.,,KHT
879385443,F3,Huang et al. (2020),"Huang J, Hu Y, Zheng F. Research on recognition and protection of ecological security patterns based on circuit theory: a case study of Jinan City. Environ Sci Pollut Res. 2020;27:12414–27","Huang J, Hu Y, Zheng F.",China,Research on recognition and protection of ecological security patterns based on circuit theory: a case study of Jinan City.,2013,Environmental Science and Pollution Research,Peer-Reviewed Article,huyc@cugb.edu.cn,N/A,China,Jinan,Located in the central and western part of Shandong Province and is the capital of Shandong Province.,Northern,"36 1' 00"" to 37 33' 00""
","116 12' 00"" to 117 45' 00""",Y,"Laiwu was merged into a district of Jinan, but the data obtained in this paper span up to 2016; thus, the Jinan city mentioned in this paper does not include the newly merged Laiwu. Urban impervious surfaces have gradually encroached upon green spaces in the surrounding countryside (Wang et al. 2014). From 2010 to 2016, cropland and forest land decreased by 4765 hm2 and 2184 hm2, respectively. Specifically, the reduced cropland areas were concentrated in Licheng District and Zhangqiu District, and the reduced forest land areas were concentrated in Zhangqiu District and Changqing District. The area of water bodies decreased by 69 hm2,mainly in Zhangqiu District and Shanghe District.",Multi-Patch,"Land use type, Connectivity",Land-use vector sources from the Jinan planning department. Used land-use and complimentary data to identify ESP's (ecological security patterns) which involves identifying ecological elements that are important for maintaining and controlling ecological processes in specific areas. ,"Above-ground biomass, Soil, Below-ground biomass, Dead wood/organic matter","Carbon fixation service was evaluated with the carbon fixation module of the InVEST model. Where total carbon fixation is carbon fixation aboveground, in the soil, of dead organic matter and belowground.",2016,2016,N,Patch,"Among the three ES in Jinan, the capacity for carbon fixation was hightest. Significant ecological services areas in terms of carbon fixation covered 1349 km2 (16.98%) of the total area. Forest land was the dominant ecological source. Forests were widely distributed in the southern part of the study area, providing carbon fixation and water conservation services for urban development.",Y,"Management, Restoration",Management,Restoration,N/A,"Widening ecological corridors will disperse current tranmissions, indicating more possibilities for biological communication, but doing so will also lead to higher maintenance or reconstruction costs. Overlaying identified ecological corridors with barriers resulted in 66.45% of the total area of barriers coincided with corridors, indicating that most barriers need to be improved. ESPs in this paper. “One center” indicates that the southern Fig. 7 The proportions of land-use types in restoration areas of different levels mountainous area (a large tract of ecological sources) should be given priority in ecological security protection and designated as the ecological center of gravity in Jinan, as it performs important ecological radiation functions.",,KHT
897599677,F4,Ferrari et al. (2017),"Ferrari B., Mancini L.D., Salvati R., Barbati A., Corona P. Taking the pulse of forest plantations success in peri-urban environments through continuous inventory. New Forests. 2017;48:527–45. ","Ferrari B., Mancini L.D., Salvati R., Barbati A., Corona P.",Italy,Taking the pulse of forest plantations success in peri-urban environments through continuous inventory,2017,New Forests,Peer-Reviewed Article,barbati.sisfor@unitus.it,N/A,Italy,Rome,"The Castel di Guido estate extends for 3673 ha along the Tyrrhenian coast of central Italy, within the Municipality of Rome",Northern,N/A,N/A,Y,"Since the end of the tenth century, the estate of Castel di Guido has been an agricultural center with cultivations and livestock on the flat areas and natural vegetation on steeper slopes. Farmland still covers most of the Castel di Guido estate (61%). Patches of natural vegetation (17%), especially Mediterranean maquis, and forest plantations (6%) are spread within the agricultural matrix. Urban, industrial and rural infrastructures cover the remaining area (12%).",Patch,"Native species, Composition","Mainly characterized by thermophilous and mesophytic broadleaved tree species (Quercus cerris L., Quercus frainetto Ten., Quercus pubescens Willd, Quercus suber L., Carpinus orientalis Mill., Carpinus betulus L., Fraxinus angustifolia Vahl). The plantation design is arranged into three main tracts of reforested areas, which extend the small remnants of natural vegetation and link them together. The planting spacing ranges from 3 x 2 m to 4 x 4 m. Stand types: conifers, mixed species, evergreen oaks, deciduous oaks, other broadleaved","Above-ground biomass, Below-ground biomass","Ctot total carbon, above below biomass (t), V = tree volume (m3), WDB Wood Basic Density (t m-3), BEF Biomass Expansion Factor, R Root-to-Shoot Ratio, CF carbon fraction of the dry biomass (0.5).",1997,2013,N,Patch,"Plantation failures rate is, on average, lower in mixed broadleaved plots (6%) and in other broadleaved plots (10%). Carbon sequestration of Castel di Guido reforestation can be compared with data on urban forests carbon sequestration documented for other European cities. The average values of above-ground carbon storage at the inventory year 2013 can be estimated as follows: broadleaved plots 55.88 Mg C ha-1, in mixed forest 117.56 Mg C ha -1, coniferous forest is 88.30 Mg C ha-1. The average carbon uptake level of the Castel di Guido reforestation, at the year 2013, is estimated as high as 14 Mg CO2 ha-1 year-1. As a whole, Castel di Guido reforestation with a surface area of 289 ha (4125 Mg CO2 year-1) allows for offsetting the 0.04% of CO2 emissions of the city of Rome, as assessed at the year 2010 (10 008 879 Mg CO2, year-1. Mixed surveyed stands have given better results in terms of survival and wood productivity in comparison to pure stands.",Y,"Restoration, Management",Restoration,Management,N/A,"For this reason, establishing a mix of different species in forest plantations is highly recommended, also as a way to optimize carbon sequestration. Mixed species plantation is also useful to enhance the presence of native biodiversity: they increase the range of habitat types available for native species (Norton 1998; Hartley 2002) and, being more resistant and resilient to natural and human disturbances. Although, within a carbon balance perspective, the total CO2 emissions offsetting capacity of this peri-urban reforestation might today appear ‘a drop in the ocean’, the quantification of the CO2 uptake by the reforestation might offer scientific support to urban policies aimed at reducing CO2 emission by primarily limiting further land take on agricultural land.",,KHT
879385448,F5,Flynn & Traver (2013),"Flynn KM, Traver RG. Green infrastructure life cycle assessment: A bio-infiltration case study. Ecological Engineering [Internet]. 2013 [cited 2022 Oct 26];55:9–22. Available from: https://linkinghub.elsevier.com/retrieve/pii/S0925857413000190","Kevin M. Flynn, Robert G. Traver",United States,Green infrastructure life cycle assessment: A bio-infiltration case study,2013,Ecological Engineering,Peer-Reviewed Article,kflynn@akrf.com,"The thesis paper, “Evaluation of Green Infrastructure Practices Using Life Cycle Assessment” (Flynn, 2011), provides additional detail on this green infrastructure LCA methodology, additional documentation related to the bio-infiltration case study, and LCA case studies for additional green infrastructure practice types. This document is on record at Villanova University and is available online at the Villanova Urban Stormwater Partnership Website (www.villanova.edu/VUSP).",United States,Philadelphia,"The rain garden is located on the Villanova University campus in southeastern Pennsylvania, within the Darby-Cobbs Watershed.",Northern,N/A,N/A,N,N/A,Patch,"Land use type, Native species","The goal of this study is evaluate life cycle benefits and impacts of the Villanova University bio-infiltration rain garden, which includes grass and native plants, including Ammophilabreviligulata (American beachgrass), Baccharishalimifolia (groundsel tree), Iva annua (marsh elder), Panicumamarum (coastal panic grass), Panicumvirgatum (switchgrass), Prunus maritime (beach plum), Schizachyriumscoparium (little bluestem), and Solidagosempervirens (seaside goldenrod). The plants chosen for this rain garden are native to the New Jersey Atlantic coast. They were selected for their ability to withstand both dry and ponded water conditions in the rain garden. After ten years, it was found that Acer negundo (box elder), Platanusoccidentalis (sycamore), Aroniamelanocarpa (black chokeberry), and Ilex verticillata (winterberry) were also growing, among some other shrubs herbaceous species. ",Above-ground biomass,"The U.S. Forest Service’s i-Tree Eco model was utilized. A detailed vegetation survey was undertaken at the bio-infiltration rain garden to collect input data for this urban forest model. Air pollution and metrological data from the Philadelphia International Airport weather station (Weather Station ID 72408013739) was utilized for the bio-infiltration rain garden i-Tree Eco model. For this case study, carbon storage and sequestration results are for trees only. ",2010,2010,N,Patch,"Silica sand and bark mulch were identified as the significant environmental impact pathways for the rain garden construction phase. Of the assessed environmental impact categories, the construction impacts with regard to global warming, cancer human health impact, non-cancer human health impact, eutrophication, and eco-toxicity potential are all projected to be offset within the assumed 30 year operational life of the bio-infiltration rain garden. Urban forest benefits, stormwater management benefits, and benefits to combined sewer systems were found to net an annual avoided environmental impact over the operational phase of the rain garden. Under the media reuse decommissioning scenario, the rain garden provides net avoided environmental impacts for global warming potential, cancer human health impact, non-cancer human health impact, eutrophication potential, and eco-toxicity. The media disposal scenario offsets all environmental benefits accrued over the operation phase of the rain garden, with the exception of global warming potential. ",Y,Management,Management,N/A,N/A,"It is recommended that alternatives be investigated to the use of silica sand as a soil amendment to produce rain garden media. Alternatives include the natural soil, naturally occurring sand, a sandy soil, an engineered rain garden media, or reducing the volume of silica sand by reducing the depth of the rain garden media. Alternatives to bark mulch could be  mulch produced onsite from organic waste or rubber mulch produced from recycled tires. If bark mulch must be used it is recommended that it is only applied during the initial establishment phase of the rain garden vegetation and not reapplied throughout the operation phase of the practice unless deemed necessary for the health of the vegetation. It is recommended that a decommissioning plan be put in place for the Villanova University bio-infiltration rain garden that requires the reuse of the rain garden media at the end of the practice life cycle. Conduct LCA case studies for additional types of structural green infrastructure practices. Conduct LCA case studies for non-structural green infrastructure practices such as open space preservation, riparian buffer restoration, and stream restoration. Investigate the applicability of the impact scaling techniques described in this study through case studies of green infrastructure practices of different sizes and scales. Investigate impact assessment methodology beyond the TRACI impact categories, including weighted single impact scoring methodologies. Expand social and economic impact categories in future case studies. Conduct LCA case studies of green infrastructure practices at the conceptual design stage to investigate the usefulness of the green infrastructure LCA methodology applied in this case study as a tool for project planning. Apply the green infrastructure LCA methodology utilized in this case study to a broader array of infrastructure and environmental projects.",,EC
879385451,F6,Wei et al. (2021),"Wei S, Chen Q, Wu W, Ma J. Quantifying the indirect effects of urbanization on urban vegetation carbon uptake in the megacity of Shanghai, China. Environ Res Lett. 2021;16:064088.","Wei Shuyun, Chen Qiuji, Wu Wanben, Ma Jun",China ,"Quantifying the indirect effects of urbanization on urban vegetation carbon uptake in the megacity of Shanghai, China",2021,Environmental Research Letters,Peer-Reviewed Article,ma_jun@fudan.edu.cn,N/A,China ,Shanghai,"Shanghai, a megacity in eastern China covering an area of about 6340 km2 , is part of the alluvial plain of the Yangtze River Delta, with an average elevation of about 4 m. Shanghai has a subtropical monsoon climate, with four distinct seasons and abundant sunshine and rainfall. ",Northern,"120 52′ 00"" to 122 12′ 00""","30 40′ 00"" to 31 53′ 00""",Y,"Shanghai has witnessed significant urbanization over the past several decades. In particular, since the beginning of the 21st century, the population in Shanghai has increased steadily, from 1.6 million in 2000 to 24.2 million in 2016. Industrial zones and functional areas have become dramatically prominent due to the demand for land resources in the central urban area, propelled by the utilitarian housing policy and the real estate industry since 1998, which jointly led to an increase in the impervious surface
area. The impervious surface in Shanghai also dramatically increased by 95%, from 1587.64 km2 in 2000–3097.83 km2
in 2016, and the newest generated impervious surface was converted from urban vegetation, including forest land, grassland, and cropland.
",Patch,Connectivity,"This article combined the Forest componet into vegetation cover. The chose areas in which the vegetation distribution did not change in 2004, 2010, and 2016 as the unchanged vegetation areas on the basis of the land use map of Shanghai. ",Above-ground biomass,"The VC of urban areas controlled the cabon uptake of vegetation. In order to exclude the influence of VC on urban and rural vegetation carbon uptake, we used the VC data with a 500 m resolution in 2004, 2010, and 2016. The VC was also calculated based on the following equations for moving ‘windows’ of 15 × 15 pixels: VC = Nf/Nw, where Nf represents the number of vegetation pixels in a window and Nw represents the number of total pixels in a window. The range of VC is the same as that of VLC, where 0 represents non-vegetation and vice versa.",2004,2016,N,Patch,"urbanization promoted the vegetation carbon uptake in the downtown area and the transition zone between urban and rural areas, mainly by modifying the spatial pattern of vegetation to change. The impact of urbanization on the vegetation landscape was generally manifested as a reduced connectivity of vegetation, which was positively associated with the vegetation carbon uptake ability.                                                                                                 Urbanization leads to an increase in the proportion of impervious surfaces, which reduces the Vegetation cover in this area, thus reducing the carbon uptake capacity of the area. the largest relative contributionto the change of vegetation carbon uptake was from Vegetation landscape connectivity, followed by temperature. The contributions of Vegetation Landscape connectivity to vegetation carbon uptake in 2004, 2010, and 2016 were 77%, 81%, and 85%, respectively. Thus, it can be seen that the landscape pattern’s indirect impact on vegetation is crucial. ",Y,Management,Management,N/A,N/A,"the sustainability of the urban landscape should be considered in urban landscape planning; that is, a balance should be struck between land use and ecosystem services within the city. the sustainability of the urban landscape should be considered in urban landscape planning; that is, a balance should be struck between land use and ecosystem services within the city. Critically,
future research must aspire to quantify the relationships between urban environments and vegetation carbon uptake at local, regional, and global scales.

Considering the crucial role of landscape patterns in the carbon uptake of vegetation, urban managers should consider reducing the negative influence of urbanization on vegetation through landscape design, which will further promote the sustainable development of urban ecology.",,EP
