Rayyan.ID,Article.ID,Citation,Auth,Country.Auth,Title,Year,Journal,Pub.Type,Email,Supp,Study.country,City,Geo.region,Hem,Lat,Long,Urb.scale,Forest.comp,Desc.forest,#Species,Common.name,Latin.name,Field.history,Desc.field,Start.year,End.year,Month.start,Month.end,Intervalled,Comparator,Scale.meas,Bird.domainraw,birddomain1,birddomain2,birddomain3,birddomain4,Bird.category,Category.multi,Result,Rec.,Rec.type,Rec.1,Rec.2,Rec.3,Rec,Comments,Reviewer.intial
364026484,A216,Mohring et al. (2020),"Mohring B, Henry P-Y, Jiguet F, Malher F, Angelier F.",France,Investigating temporal and spatial correlates of the sharp decline of an urban exploiter bird in a large European city.,2020,Urban Ecosystems,Peer-Reviewed Journal,bertille.mohring@abo.fi,N/A,France,Paris,"""From 2003 to 2017, a large House Sparrow census by point counts has been carried out by 127 volunteers and coordinated by the Ligue pour la Protection des Oiseaux (LPO) Ile-deFrance at 196 sites in the inner Paris (excluding the two surrounding woods).""",Northern,N/A,N/A,Multi-patch,"Forested area, Composition","""Therefore, we focused specifically on (1) vegetation because of its expected importance in terms of sheltering sites and source of seeds and invertebrate preys, (2) built-up areas because of their expected importance in terms of sheltering and nesting sites...""
",One,House Sparrows,Passer domesticus,N,N/A,2003,2017,March,April,Y,N,Individual,Biodiversity,Biodiversity,,,,Abundance,Abundance,"""By studying fine-scale habitat characteristics, we highlighted that although House Sparrows were more numerous in sites characterised by large green space areas and relatively new buildings, they declined at all sites independently of habitat characteristics.""",No,N/A,N/A,,,N/A,,KHT
364026486,A217,Ferenc et al. (2014),"Ferenc M, Sedláček O, Fuchs R.",Czech Republic,How to improve urban greenspace for woodland birds: site and local-scale determinants of bird species richness.,2014,Urban Ecosystems,Peer-Reviewed Journal,zbrd@email.cz,N/A,Prague,Czech Republic,"""The study took place in Prague, city (1 270 000 inhabitants) located in a continental temperate climate of central Europe (centre 50.04 N, 14.25 E, altitude range 170400 m a.s.l., Czech Republic).""",Northern,N/A,N/A,Multi-patch,"Forested area, Composition","""First, we estimated the absolute area covered by urban greenery within each sampling site (hereafter “surveyed area”) using aerial photographs (www.mapy.cz). This variable (surveyed area) has been used as a covariate in further analyses to account for total amount of focal habitat sampled at particular sites. Further, we estimated the relative cover of sparse and dense herbaceous vegetation, sparse and dense shrubs and different age cohorts of trees (according to the diameter at breast height (DBH): (i)<30 cm, (ii) 31–50 cm and (iii) above 50 cm) within the surveyed area. We recorded the number of tree species that covered at least 5 % of the surveyed area and the ratio of deciduous and coniferous trees. The presence of water body (streams, ponds) at sampling sites has also been recorded.""",Many,More than 10,More than 10,N,N/A,2007,2008,April,June,Y,N,Community,Biodiversity,Biodiversity,,,,Biodiversity metric,Biodiversity metric,"""We found that the tree species richness, proportion of older tree stands and presence of water bodies represent the most important habitat variables at the site scale (100 m radius plots). The diversity of woodland bird communities at a particular site was further positively influenced by both the amount of continuous tree cover (e.g. parks, urban woodlands), or scattered trees of residential areas around the sampling sites.""
""We found that the overall richness of bird communities was supported by higher proportion of total tree cover surrounding our sampling sites in urban green and declined towards more urbanized areas with higher housing density and cover of pavements (l-PC1 axis). More specifically, we identified that bird communities were enriched by about two species, if more than half of the 500 m surroundings (corresponding to about 40 ha in total) were covered by trees. This implies that not only habitat patch size (Husté et al. 2006; Evans et al. 2009) but also total amount of tree cover scattered in an urbanized area (Pellissier et al. 2012) is important for species richness of woodland bird communities.""",Yes,Management,Management,,,"""These results show that at least part of the woodland species does not distinguish between the habitat patches of continuous tree cover and the scattered greenery of residential areas. Management at the level of particular administrative units of a city should therefore focus on maintenance and promoting of the total amount of greenery, including smaller areas of public spaces (e.g. squares), wooded streets and private gardens.""",,KHT
364026480,A218,Curzel et al. (2021),"Curzel FE, Bellocq MI, Leveau LM. ",Argentina,Local and landscape features of wooded streets influenced bird taxonomic and functional diversity. ,2021,Urban Forestry & Urban Greening,Peer-Reviewed Journal,curzel@ege.fcen.uba.ar,N/A,Argentina,Buenos Aires,"""Buenos Aires city is located in the Rolling Pampas, the native landscape that was dominated by grasslands and xerophytic forest formations (Morello et al., 2012; Oyarzabal et al., 2018). At present, this region is primarily composed of agroecosystems and some exotic tree plantations (Morello et al., 2012).""",Southern,34 36' 14' S,58 22' 54' W,Multi-patch,"Canopy Cover, Land use type, Composition, Forested area","""Environmental variables were established at two different scales. At a landscape scale, we analyzed the isolation to green areas, the distance to the nearest green area, and green area coverage within a 200 m radius from the transect.""
""At the transect scale, we measured the following environmental variables: tree coverage, tree species richness, tree composition, average diameter at breast height (DBH) and standard deviation of diameter at breast height (sdDBH), building coverage, motorized vehicle traffic, and pedestrian traffic.""",Many,More than 10,More than 10,N,N/A,2015,2016,October,January,Y,N,Population,Biodiversity,Biodiversity,,,,"Abundance, Biodiversity metric",≥ Two topics,"""Total species richness was negatively related to tree coverage and motorized vehicle traffic on the streets, whereas total species richness was positively associated with the standard deviation of diameter breast height (Table S2, Fig. 3a–c). Native species richness was negatively related to motorized vehicle traffic (Table S2, Fig. 3d). Total species evenness was negatively related to tree coverage, pedestrian traffic, and distance to green areas (Table S2, Fig. 4a–c). Native species evenness was negatively associated with tree coverage, pedestrian traffic, and distance to green areas (Table S2, Fig. 4d, g, h).In addition, native species evenness increased with the coverage of low buildings and no building coverage (Table S2, Fig. 4e, f). Total species Shannon diversity and native species Shannon diversity were negatively related to tree coverage and motorized vehicle traffic and were positively related to standard deviation of diameter of breast height (Table S2, Fig. 5a–e, g). Native species Shannon diversity decreased with the coverage of high buildings and distance to green areas (Table S2, Fig. 5f, h).""",Yes,Management,Management,,,"""Some actions could be implemented to decrease the negative effects of human disturbance. One possible option is traffic calming, which is a setof strategies created to make the streets safer, for example by reducing speed or redistributing traffic in the city (Bunn et al., 2003); traffic calming could be used to improve bird diversity""
""In addition, the improvement of public transport services, such as subways and trains, could reduce car, motorbike and pedestrian traffic. Another alternative is to distribute throughout the city public and governmental buildings, banks and offices to disseminate the motorized vehicles and pedestrian traffic throughout the city.""
""Parks in the urban landscape represent bird diversity hotspots due to their complexity and availability of resources for birds (de Castro Pena et al., 2017; Fern ́andez-Juricic, 2000a; Strohbach et al., 2013). Maintenance of these areas is essential to conserve bird communities.""",Good recommendation,DMR
364026501,A219,Ikin et al. (2012),"Ikin K, Knight E, Lindenmayer DB, Fischer J, Manning AD.",Australia,Linking bird species traits to vegetation characteristics in a future urban development zone: implications for urban planning.,2012,Urban Ecosystems,Peer-Reviewed Journal,karen.ikin@anu.edu.au,N/A,Australia,Canberra,"""Our study was located within the lower Molonglo Valley in Canberra, the Australian Capital Territory (ACT), Australia (Fig. 1; also see Stagoll et al. 2010).""",Southern,N/A,N/A,Multi-patch,"Individual tree management, Composition, Exotic/invasive species, Land use type","""We recorded seven variables to reflect the patch-scale vegetation characteristics of each site: (1) dominant bark type; (2) tree stem density; (3) presence of tree hollows (cavities); (4) presence of tree regeneration; (5) percent cover of shrubs; (6) presence of the exotic weed blackberry (Rubus fruticosus aggregate); and (7) percent cover of grass (Table 4).""",Many,More than 10,More than 10,N,N/A,2008,2008,N/A,N/A,Y,N,Community,Biodiversity,Biodiversity,,,,Abundance,Abundance,"""Community composition was influenced by landscape vegetation attributes, and species traits were clearly and directly related to vegetation characteristics.""
""Intuitive examples included: (1) the association of arboreal nesters and foragers with high numbers of trees, and the converse relationship between ground nesters and treeless land; (2) the occurrence of shrub insectivores and understory nesters where shrub cover was high; and (3) the relationship between aerial insectivores and more open grassy conditions. Individual bird species are known to respond to vegetation characteristics (MacArthur 1964; McElhinny et al. 2006) and land-use history (Glennon and Porter 2005; Gustavsson et al. 2007), and our findings confirm that these responses are a function of their ecological and biological traits.""
",Yes,"Conservation, Management, Restoration",Conservation,Management,Restoration,"""Based on the relationships between species traits and vegetation characteristics, four plausible high-priority actions to maintain the current bird community within the Molonglo Valley development zone would be: (1) river restoration; (2) maintenance of a shrub understory (possibly around stands of remnant trees); (3) preservation of grassland areas (e.g. within public open spaces); and (4) promotion of vegetation heterogeneity across the urban landscape.""",,KHT
364026507,A220,Matsuba et al. (2016),"Matsuba M, Nishijima S, Katoh K.",Japan,"Effectiveness of corridor vegetation depends on urbanization tolerance of forest birds in central Tokyo, Japan.",2016,Urban Forestry & Urban Greening,Peer-Reviewed Journal,misakomatsuba@hotmail.com,N/A,Tokyo,Japan,"""The study area was located in the center of Tokyo, Japan (Fig. 1). A suburban mosaic of residential and commercial land uses dominates central Tokyo, with certain areas utilized for agricultural purposes.""",Northern,N/A,N/A,Patch,"Composition, Forested area, Connectivity","""In the study area, three extensive corridors that stretch from the east to the west are characterized by their vegetation structures.""
""To estimate the vegetation coverage, we conducted visual vegetation structure surveys at each bird sampling points in the wooded patches from November to December 2010. Coverage was recorded for the following layers: ground (0–0.5 m), shrub (0.6–2 m), subtree (2.1–8 m), and tree (>8 m) by seven ranks [0, 0.5, 1 (1–10%), 2 (11–25%), 3 (26–50%), 4 (51–75%), and 5 (75–100%)].""
""We investigated the effects of the urban landscape surrounding a patch using the normalized difference vegetation index (NDVI).""",Many,More than 10,More than 10,N,N/A,2009,2010,December,June,Y,N,Community,Biodiversity,Biodiversity,,,,"Biodiversity metric, Abundance",≥ Two topics,"""The species richness and total abundance of the urban avoider group during winter were higher in the patches near CorridorTU, which comprised planted mature broadleaf woodland and dense understory vegetation (Table 1). This highlights the importance of vegetation structures on bird species in nearby small wooded patches, although additional surveys using a larger number of corridors are required to confirm the generality of the current results.""
""Importantly, the effectiveness of corridor vegetation appears higher in areas containing many scattered greenspaces (i.e., higher NDVI), particularly for abundance during winter (Figs. 3 and 4).""
""The corridor type was not influential in top five models for the suburban adapter group (Table 2), suggesting that their distribution is independent of the vegetation types in corridors. This pattern might occur because of the higher capability of suburban adapters to exploit the matrix compared with that of the urban avoiders.""
",Yes,Management,Management,,,"""From the view of management of greenspaces, the maintenance of shrub or understory vegetation is encouraged not only in patches but also in corridors. However, this may be in conflict with safety and aesthetic values of the environments for humans in urban landscapes (Heyman, 2010).""
""One possible strategic approach is to differentially select and manage corridors for forestdwelling bird species, particularly for urban avoiders. On the basis of our results (Fig. 3b), we suggest that the management practice of increasing vegetation in corridors will be better implemented in a landscape with numerous scattered greenspaces (as in Fig. 4a) or that neighbor larger patches (Fig. 3a), whereas management for humans should be prioritized in a landscape with more artificial land use (as in Fig. 4b).""
",,KHT
364026509,A221,van Heezik et al. (2013),"van Heezik Y, Freeman C, Porter S, Dickinson KJM.",New Zealand,"Garden Size, Householder Knowledge, and Socio-Economic Status Influence Plant and Bird Diversity at the Scale of Individual Gardens.",2013,Ecosystems,Peer-Reviewed Journal,Yolanda.vanheezik@otago.ac.nz,N/A,New Zealand,Dunedin,"""The study took place in Dunedin (population 120,000), South Island, New Zealand (see Freeman and others 2012).""",Southern,N/A,N/A,Patch,"Native species, Composition, Forested area","""The vegetated area was calculated from aerial photographs and expressed as both the proportion of the total property, and the area (m2).""
""All woody plants taller than 0.5 m were recorded, identified as native or exotic, and to species level where possible. Vegetation structure was recorded in height tiers: shrub (0.5–2 m.); multi-stemmed tree (0.5–<2 m.); multi-stemmed tree (2–< 5m; diameter at breast height d.b.h. <10 cm.); short tree (2–5 m., d.b.h ‡10 cm.); and tree (‡5 m).""
",Many,More than 10,More than 10,N,N/A,2009,2009,N/A,N/A,Y,N,Community,Biodiversity,Biodiversity,,,,"Abundance, Biodiversity metric",≥ Two topics,"""Just over half of the variation in overall woody plant species richness among properties was explained mainly by three variables; the vegetated area of the garden, the capital value of the property and the ability of the householder to discriminate between native and exotic plant and animal species (ID native; Table 2; Figure 1).""
""Although the attitudes and knowledge of householders contributed to an extent in explaining variation in plant and bird richness and diversity among gardens, the overwhelmingly important garden characteristic was the size of the vegetated area or the proportion of the property vegetated. All models in all sets included either one of these as the most important variable.""
""Over all gardens we found 83% of woody species were exotic, although within individual gardens there were generally about twice as many exotic woody species and individual plants as there were native.""
""Bird species richness in individual gardens was positively associated with the area covered by beds and hedges within the gardens, although the vegetated area of the property was twice as important as any of the other variables. Local habitat variables measured at small scales are important in explaining bird communities, with even small numbers of native trees and shrubs acting to attract birds (Daniels and Kirkpatrick 2006; Goddard and others 2009; Lerman and Warren 2011; Luck and others 2012).""",Yes,Management,Management,,,"""To maintain and enhance these roles requires that those characteristics found in larger vegetated properties be supported and encouraged. Town planners should consider biodiversity when formulating strategies and regulations concerning property size, garden size, and the proportion of the garden that remains vegetated.""",,KHT
364026503,A222,Morelli et al. (2018),"Morelli F, Mikula P, Benedetti Y, Bussi` ere R, Tryjanowski P",Czech Republic,"Cemeteries support avian diversity likewise urban parks in European cities: Assessing taxonomic, evolutionary and functional diversity, Urban Forestry and amp",2018,Urban Forestry & Urban Greening,Peer-Reviewed Journal,morellius@libero.it,N/A,"Multiple (Czech Republic, Poland, Italy, France)",N/A,"""Data on bird communities of parks and cemeteries were collected in urban, peri-ruban and rural areas of the Czech Republic, France, Italy and Poland (Fig. 1).""",Northern,N/A,N/A,Multi-city,"Land use type, Forested area","""We used the following descriptors: size of the site (park/cemetery), local vegetation characteristics (grass, shrub and tree coverage), and local human-related structures (number of street lamps; chapel, flowerbed and tombstone coverage). The vegetation structure attributes around each sampling point were estimated for the ground level (referred to as grass coverage, although we took into account also other herbaceous plants), medium level (shrub coverage) and tree level (tree coverage).""",Many,More than 10,More than 10,N,N/A,2014,2014,April,June,Y,Y,Community,"Demographics/Patterns, Breeding, Biodiversity",Demographics/Patterns,Breeding,Biodiversity,,"Meso breeding, Biodiversity metric, Community changes",≥ Three topics,"""The GLMM analysis revealed that variations in bird community metrics were associated with site size, local vegetation characteristics and human-related structures, although with different responses in each particular metric. In both parks and cemeteries, BSR was slightly positively correlated with site size and tree coverage around the sampling point, while negatively associated with altitude (Table 1, Fig. 3). In contrast, FD of bird communities was statistically unrelated to all environmental characteristics estimated at the sampling point (Table 1). Finally, the mean ED score of bird communities was positively correlated with tree coverage, but negatively associated with flowerbed coverage and the “urban” category of urbanization (Table 1, Fig. 4).""
"". Our findings also highlight the importance of tree coverage in maintaining both species richness and evolutionary uniqueness of bird communities across urban green areas.""",Yes,Management,Management,,,"""The importance of size of urban green areas as support for biodiversity is most significant for taxonomic and evolutionary diversity of bird communities. Also by increasing the tree coverage, it is possible to enhance both taxonomic richness and evolutionary uniqueness of bird communities in parks and cemeteries of rural, peri-urban and urban areas. Similar urban planning strategies could be applied for parks and cemeteries, because both constitute a similar support for avian diversity.""",,DMR
364026520,A223,Schütz and Schulze (2015),"Schütz C, Schulze CH",Austria,"Functional diversity of urban bird communities: effects of landscape composition, green space area and vegetation cover. ",2015,Ecology and Evolution,Peer-Reviewed Journal,claudia.schuetz@univie.ac.at,N/A,Austria,Vienna,"""The study was carried out in Vienna (48°130 N, 16°220 E), the capital city of Austria, located at the northeastern extension of the Alps and predominantly situated within the Vienna Basin (Berger and Ehrendorfer 2011). A total of 208.42 km2 (50.2%) of the city area is not built-up. Nearly 6% consist of city parks and other man-made green space.""",Northern,N/A,N/A,Patch,"Canopy Cover, Forested area","""For each city park, area and tree cover were considered. Park size was calculated in ArcGIS 10.0 (ESRI, Redlands, CA, USA) based on Vienna land use data of the year 2009 (Table S1). Tree cover of each city park was digitized in ArcGIS 10.0 (ESRI)""
""For calculating the canopy cover heterogeneity of each city park, the perimeter of digitized canopy (m) was divided by the area of closed canopy (m2), defined as closed leaf cover tolerating gaps up to 5 m (Table S1).""",many,More than 10,More than 10,N,N/A,2009,2013,January,December,Y,N,Community,Biodiversity,Biodiversity,,,,Biodiversity metric,Biodiversity metric,"""Park size is a very important parameter in explaining differences between city parks in the considered taxonomic and functional diversity metrics, as it was included in the best ranked models for species richness, FRic, and FDiv.""
""Because of a greater habitat complexity and more prominent core areas in larger parks, increasing park size results not only in a higher number of recorded species, but also in an increase in FRic as larger niche space can be filled by avian communities.""",Yes,Management,Management,,,"""These results have important implications for urban planning aiming to promote and maintain high diversity and ecosystem function in modern human-dominated landscapes.""",Weak result and recommendations.,DMR
364026523,A224,Schneider et al. (2015),"Schneider SC, Fischer JD, Miller JR. ",USA,Two-sided edge responses of avian communities in an urban landscape. Urban Ecosyst.,2015,Urban Ecosystems,Peer-Reviewed Journal,fischer9@illinois.edu,N/A,USA,Chicago,"""We focused on forest remnants in the Chicago metropolitan area, a region in the Midwestern USA that encompasses northeastern Illinois, northwestern Indiana, southwestern Michigan, and southeastern Wisconsin with a population totaling more than 9.8 million people""",Northern,N/A,N/A,Multi-patch,"Exotic/invasive species, Land use type, Forested area, Canopy Cover",""". Given limited access in suburban areas, we took a number of coarse habitat measurements along the point transects. We visually estimated percent shrub cover to the nearest 5 % and the number of trees (>2 m in height and 8 cm diameter-at-breast-height) within 50 m of every point.""
""At forest points, we measured canopy cover using a spherical densiometer and quantified the degree of invasion by non-native plants""",many,More than 10,More than 10,N,N/A,2010,2011,May,July,Y,Y,Community,"Biodiversity, Demographics/Patterns",Biodiversity,Demographics/Patterns,,,"Community changes, Abundance",≥ Two topics,"""Avian assemblages differed by habitat type but not site (F=6.84, p<0.001; F=0.47, p=0.99 respectively). Composition of avian assemblages differed significantly among distance categories (F=15.74, p<0.001; Table 1). Bird assemblages did not differ significantly with distance-from-edge in the suburbs, but did in forested habitat.""
:In this study, forest-suburban edges clearly exerted a strong influence on bird communities. The most notable difference in community structure and composition was between bird assemblages of the two habitat types.""
",No,N/A,N/A,,,N/A,,DMR
