879385695,F40,Nicese et al. (2021),"Nicese FP, Colangelo G, Comolli R, Azzini L, Lucchetti S, Marziliano PA, et al. Estimating CO2 balance through the Life Cycle Assessment prism: A case – Study in an urban park. Urban Forestry & Urban Greening. 2021;57:126869.","Nicese FP, Colangelo G, Comolli R, Azzini L, Lucchetti S, Marziliano PA, Sanesi G.",Italy,Estimating CO2 balance through the Life Cycle Assessment prism: A case – Study in an urban park.,2021,Urban Forestry & Urban Greening,Peer-Reviewed Article,francesco.nicese@unifi.it,N/A,Italy,Milan,"The park covers more than 600 ha; about 100 ha are represented by afforested areas and the remaining part is covered by other green typologies (GTs), namely lawns (211 ha), social allotments (2.10 ha), hedges (0.84 ha), tree rows (14.40 ha), recreational facilities, small lakes, grey infrastructures (schools, hospital, private airport) and agricultural areas (Marziliano et al., 2013; Sanesi et al., 2007) (Fig. 1).",Northern,N/A,N/A,Y,"The first important forestation interventions date back to 1983; other large afforestation occurred throughout the 1980s and ‘90 s. Forestry plantations continue with interventions of limited extension (Sanesi et al., 2007; Panno et al., 2017, 2020). PNM represents a specific type of NBS nd consists of reclaimed post-industrial or uncultivated lands (Panno et al., 2017; Sanesi et al., 2007).",Patch,"Native species, Land use type, Composition, Exotic/invasive species, Forested area","The trees planted in PNM upon its establishment (1983) mainly reflect the Lombardy forest landscape of lowlands (i.e. Acer spp., Carpinus betulus, Fraxinus spp., Prunus avium, Quercus cerris, Quercus robur, Tilia spp., Ulmus spp.), but also some non-native species, commonly found in urban parks over the last two centuries, were introduced (e.g. Quercus rubra). Sambucus nigra, Crataegus monogyna, Cornus sanguinea, Viburnum lantana, and Corylus avellana were the most used shrub species. In 1983 (Sanesi et al., 2007) tree specieswere planted at a density of 1110 trees/ha; later, other trees and shrubs were planted using different plantation schemes, plantation densities (up to 3000 plants/ha), and vegetation types (i.e. shrubs were introduced). Over the years, the established trees were analyzed in terms of height growth, crown width, and vertical structural models (Marziliano et al., 2013).","Soil, Above-ground biomass, Below-ground biomass","C sink was estimated by calculating the CO2e stored both in plant above - belowground biomass and in soil as organic carbon, according with the mainstream research of LCA in urban forestry. For FA, field data collectionwas performed in nine plots, two of 40m × 30m and sevenof 40 m × 40 m for T, in the rows of trees present along the avenues of PNM. Within each plot and along avenues, all trees were classified according to age, stem diameter at breast height (DBH), and height (H). In total, about 1000 trees were sampled. In this study, to estimate the above-ground biomass, we used allometric relationships based on the diameter at breast height (DBH), and among these, the following power function (Eq 1) is certainly the most adopted (Niklas, 1994; Kaitaniemi, 2004). The estimate of belowground biomass (BGB) was carried out via the following equation (Eq. 5). The total C stock stored by woody plants was determined by multiplying the total biomass (TB) by a conversion coefficient of 0.50 (Pre gitzer and Euskirchen, 2004). Instead, using the equivalence 1 Mg C = 3.66 Mg CO 2 (IPCC, 2006), the equivalent amount of carbon dioxide removed from the atmosphere from plant biomass present in PNM was determined.",N/A,N/A,N,Individual,"The results obtained for the green area of PNM, observed over a 50years period, shows a C sequestrationcapacity 10 time higherthan the C emission. The five GTs considered gave different results, in terms of CO2e emissions and/or potential C stock; such differences were mainly due to the maintenance requirements (above all pruning) and green waste management with regard to emissions (Fig. 5), and presence of woody species (above all trees) for the C sequestration. The best performances in terms of CO2e balance per surface unit was obtained with tree rows and afforested area typologies (- 789 and – 527 Mg CO 2e ha 1 50yrs-1, respectively), while the hedges showed the worst CO2e balance, (+ 176 Mg CO 2e ha 1 50yrs-1).",Y,Management,Management,N/A,N/A,"ifferent planting options, different pruning or thinning intensities or species selection can change this balance. In addition, converting residues from removed trees into wood products can improve the storage of CO2 for long periods. LCA has proved to be an effective tool to support the planning and maintenance of urban parks and the types considered.",,DMR
879385708,F41,"Nyelele et al., (2019)","Nyelele C, Kroll CN, Nowak DJ. Present and future ecosystem services of trees in the Bronx, NY. Urban Forestry & Urban Greening. 2019;42:10–20.","Nyelele C, Kroll CN, Nowak DJ.",United States of America,"Present and future ecosystem services of trees in the Bronx, NY.",2019,Urban Forestry & Urban Greening,Peer-Reviewed Article,cnyelele@syr.edu,N/A,United States of America,New York City,"The Bronx (Fig. 1), one of the five NYC boroughs, is divided into 1132 census block groups (US Census Bureau, 2010). The elevation of the borough ranges from 0 to 320 ft above mean sea level and the area receives mean annual precipitation of 40–52 inches with a frost-free period of 216–234 days.",Northern,N/A,N/A,N,N/A,Multi-Patch,Land use type,"We employed three datasets to determine the new tree plantings in the Bronx. The first was a dataset showing where plantings were made between 2010 and 2017 in restoration areas, including landscaped parks and other natural areas in the Bronx (NYC Parks and Recreation, 2017a). The second was a 2015–2016 Small Parks and Playgrounds (SPaP) inventory of all trees in parks and playgrounds under 6 acres (NYC Parks and Recreation, 2017b). The third was information from the 2015–2016 Street Tree Census.",Above-ground biomass,Carbon storage and sequestration were calculated using the latest per area of tree canopy cover removal rates for NYC. Carbon sequestration was estimated at 1.7 tons of carbon per acre of tree cover per year while carbon storage is 32.03 tons of carbon per acre of tree cover. ,2010,2017,N,Patch,"Increases in carbon storage and sequestration services and benefits over time are proportional to tree cover increases. In 2010, total carbon sequestration was 10,300 tons/yr ($1.3 million) and carbon storage was 195,500 tons ($25.4 million). These changes from 2010 correspond to a 10% increase for the high mortality scenario, a 16% increase for the average mortality scenario, and a 21% increase for the low mortality scenario. Carbon storage and sequestration are strongly impacted by the total amount of tree cover (Nowak et al., 2013a). In general, block groups with higher total tree cover will have greater forest carbon storage and sequestration. Thus, some of the carbon gains from tree growth are offset by carbon losses to the atmosphere via fossil fuels used in maintenance activities. Our results indicate that trees have some effect, although minimal to offset some of the carbon emissions that contribute to greenhouse gas formation.",Y,Management,Management,N/A,N/A,"Another important element to consider is the placement of trees; for example, trees strategically located around buildings can reduce building energy use and consequently lower carbon emissions from fossil-fuel-burning power plants. We have shown how cover and benefits can be enhanced by ensuring the long-term survival of newly planted trees (reducing tree mortality). Management plans should enhance the protection and maintenance of existing trees in addition to planting new trees or natural regeneration. Spatially distributed modeling approaches such as ours provide more spatially refined service and benefit estimates and have the potential to guide more local and fine scale decision making regarding where to improve or protect tree cover and maximize the services and benefits of trees.",,KHT
879385722,F42,Horn et al. (2015),"Horn J, Escobedo FJ, Hinkle R, Hostetler M, Timilsina N. The Role of Composition, Invasives, and Maintenance Emissions on Urban Forest Carbon Stocks. Environmental Management. 2015;55:431–42.","Horn J, Escobedo FJ, Hinkle R, Hostetler M, Timilsina N.",United States of America,"The Role of Composition, Invasives, and Maintenance Emissions on Urban Forest Carbon Stocks",2015,Environmental Management,Peer-Reviewed Article,fescobed@ufl.edu,N/A,United States of America,Orlando,"The northeast Orlando Metropolitan Statistical Area, Florida area (Orlando-Kissimmee-Sanford Metropolitan Statistical Area; MSA), has an estimated population of 2.2 million, spanning Orange, Seminole, Flagler, and Palm counties. The 200 km2 study area is located at 28°35033.5400Nand 81°1200.3400W. The natural vegetation in the study area is a mosaic of pine flatwoods, wetland forests, and scattered patches of scrub oak.",Northern,"28 35' 33.54"" N","81 12'0.34"" W",N,N/A,Multi-Patch,"Native species, Composition, Land use type, Exotic/invasive species","To facilitate analyses, these 43 residential plots were further categorized into three specific residential land use-cover (LULC) types based on urban form and actual land cover observations in the field: (1) low-density residential (LDR; 8 plots with 0.5–2 dwellings per acre and remnant shrub/prairies patches), (2) medium-density residential (MDR; 21 plots with 2–5 dwellings per acre), and (3) high-density residential/mixed-use urban (MUU; 14 plots with more than 5 dwellings per acre with adjacent institutional, highdensity residential, and commercial areas).. Plot measurements included percent overstory (i.e., tree and palm cover), mid-story shrub cover, and surface ground covers (e.g., impervious, soil, litter, maintained lawn, other vegetation). Tree measurements included species, diameter at breast height (DBH; stem diameter at 1.37 m above the surface), crown width, and crown characteristics.",Above-ground biomass,"In this study, C stocks were estimated for all trees measured in 2009 and 2011 using mostly biomass equations from north-central Florida. Once a tree was assigned a biomass equation, aboveground fresh weight to dry weight and dry weight to C were converted by multiplying by a factor of 0.5 in both cases (Timilsina et al. 2014a). All C stock change estimates were for a period of time ranging from 1.87 to 1.97 years, but were annualized for each individual tree using actual measurement dates from 2009 and 2011.",2009,2011,N,Individual,"Our analysis showed that indeed hardwood tree C stocks were greater than those of softwoods (P value \0.0001). Similarly, hardwood also sequestered more C than softwoods (P value \0.0001; Table 2). Wilcoxon signed rank tests also indicated that C stocks and net sequestration by native trees and palms were greater than exotics (P value\0.0001 in both cases; Fig. 1a and b). Carbon stocks and net sequestration by non-invasive trees and palms were also higher than invasive (P value \ 0.0001 in both cases; Fig. 1a and b).",N,N/A,N/A,N/A,N/A,N/A,,DMR
879385725,F43,Cabral et al. (2017),"Cabral I, Keim J, Engelmann R, Kraemer R, Siebert J, Bonn A. Ecosystem services of allotment and community gardens: A Leipzig, Germany case study. Urban Forestry & Urban Greening. 2017;23:44–53.","Cabral I, Keim J, Engelmann R, Kraemer R, Siebert J, Bonn A.",Germany,"Ecosystem services of allotment and community gardens: A Leipzig, Germany case study.",2017,Urban Forestry & Urban Greening,Peer-Reviewed Article,ines.cabral@idiv.de,N/A,Germany,Leipzig,"Our study area is the City of Leipzig (Fig. 1) located in eastern Germany with around 570,000 inhabitants. From 1930 to 2010, the city lost almost one third of its population due to several economic crises and political changes. Faced with the process of shrinkage, the municipality decided to use its voids for more public green spaces, including leasing vacant lots for community gardens. Overall, the city has over 23 m2 of gardening area per inhabitant, which is one of the highest ratios among European cities.",Northern,N/A,N/A,N,N/A,Multi-Patch,"Composition, Land use type","The sampling design consisted of both a broad and an in-depth survey of plots in six allotment estates and their adjacent community gardens. For assessing land cover and (micro) habitat provision in the gardens, we conducted field surveys in each plot to map allocation of land to the cultivation of edible plants (including berry bushes), ornamental plants (including hedges), lawns and fruit trees, as well as the proportion of sealed ground via paths or buildings as well as water bodies (such as ponds).",Above-ground biomass,"in order to understand the role played by urban allotments in climate regulation, we surveyed all six allotment estates by mapping all mature trees (over five meter tall) and classified them into deciduous/fruit and evergreen trees. we assessed above-ground carbon storage in trees for two allotment estates at the opposing ends of the urbanity gradient and differing average plot sizes: an urban allotment estate Mariannengärten with small plots. Applying the parameters shown in Table 4, we calculated biomass by applying the following allometric equation by Jenkins et al. (2003). For both allotment estates we then calculated the above-ground carbon stock of the five plots of each estate and its common playground and estimated the above-ground carbon storage in trees for the remaining plots. For this we assumed different parameters for deciduous/fruit trees and conifer trees (Jenkins et al., 2003; Table 4) and multiplied those values by the total number of similar trees in each allotment estate (cf. Appendix A3).",N/A,N/A,N,Individual,"Mapping mature trees (above five meter high) across all six allotment estates showed an overall predominance of deciduous trees in garden plots, mostly fruit trees (Fig. 5), and a higher abundance of trees in suburban than urban allotment estates. Trees within plots were often small (max height of five meter) because of regular pruning according to the allotment regulation codes. In our study, we calculated the carbon storage per hectare exemplified for two allotment estates by surveying all trees across all plots. The above-ground carbon storage was estimated at 4.3 ton C per ha for the urban Mariannengärten estate, and seven tonne C per ha for the suburban Naturfreunde estate (c.f. Appendix A3).",Y,Management,Management,N/A,N/A,"Since allotments codes determine for trees to be pruned to prevent shading in adjacent plots (Stadtverband Leipzig der Kleingärtner, 2003), larger plots are more likely to host taller trees. Accordingly, we found a higher ratio of mature trees per area within suburban allotment estates which have comprehensively larger plots. In fact the total number of mature trees ranged from 19.8 trees/ha in urban estates, to 30.2 trees/ha in suburban estates, including trees within the communal playground area, thereby increasing the estates’ contribution to above-ground carbon storage and climate regulation. Ultimately, larger plot sizes or a relaxation in bylaw regulations in urban allotments could potentially increase the abundance and size of trees and thus maximize climate regulation capacities of urban gardens.",,DMR
879385732,F44,Wang and Gao (2020),"Wang V, Gao J. Estimation of carbon stock in urban parks: Biophysical parameters, thresholds, reliability, and sampling load by plant type. Urban Forestry & Urban Greening. 2020;55:126852.","Wang V, Gao J.",New Zealand,"Estimation of carbon stock in urban parks: Biophysical parameters, thresholds, reliability, and sampling load by plant type",2020,Urban Forestry & Urban Greening,Peer-Reviewed Article,jg.gao@auckland.ac.nz,N/A,New Zealand,Auckland,"The study area is the (peri-)urban area of Auckland City located in the upper North Island of New Zealand (centred at 36.85 ◦S, 174.76 ◦E) (Fig. 1). This area covers 1,093 km2 (2015). Hilly land and scattered dormant volcanos characterise the general terrain except in the west. Auckland has a temperate maritime climate, with the average annual temperature being 14–16 ◦C and an annualprecipitation around 1,165.8 mm (Chappel, 2013). Auckland vegetation consists mainly of native trees and shrubs in reserves, grassland, and plantation forest and shrubland in previously abandoned farmland and landfills developed through natural regeneration and intervened revegetation.",Southern,36 51' S,174 45' 36'' E,N,N/A,Patch,"Composition, Exotic/invasive species, Native species","Field measurements were carried out from December, 2014 to January, 2015, and in the summer of 2016 during a revisit. In each plot, all woody plants taller than 1.3 m were surveyed. The criterion of grouping them was CH, namely,CH > 6 m as trees,1.3 m < CH ≤ 6 m as shrubs, and tree ferns/cabbage trees/palms. The last three were amalgamated into a single group due to similarities in their structure and morphology. In total, 1,681 woody plants were surveyed, plus six extra individuals measured during a revisit in 2016. Four biophysical parameters were measured for each of them, including CH, canopy area, stem length, and DBH.",Above-ground biomass,"The in situ measured biophysical parameters of woody plants were converted to aboveground biomass (AGB) with the assistance of allo metric equations developed specifically for New Zealand vegetation. Plant AGC was also subsequently aggregated by species, and to the plot level to calculate carbon stock density by dividing the total amount of AGC by the area of the 20 plots (400 m2 each).",2014,2016,N,Individual,"Specifically, an average tree stored 138.09 ± 333.7 kg C that was nearly 25 times that (5.59 ± 6.0 kg C) of an average shrub, and nearly 10 times that (13.36 ± 15.5 kg C) of a fern/palm/cabbage tree. They had a ratio of 10.3:0.4:1. Thus, trees had a disproportionally higher capacity of carbon storage than their prevalence. Trees, shrubs, and ferns/palms/cabbage trees stored, respectively, 115.30, 2.05, and 5.94 Mg C at a ratio of 19.4:0.3:1,resulting in a grand sum of 123.29 Mg C or a density of 154.12 Mg C•ha 1. f particular notice, matai, an endemic New Zealand dioecious coniferous tree, had the highest mean AGC stock of 1,289.9 kg per individual, nearly 10 times the mean AGC of an average tree.",Y,Management,Management,N/A,N/A,"Matai should be the choice in revegetation projects to maximise carbon stock given its unparalleled carbon contribution index (17.2). Stem length was totally ineffective in indicating plant carbon, followed by canopy area. Diameter at breast height (DBH) was a better indicator of tree and shrub carbon .",,DMR
879385742,F45,Beller et al. (2020),"Beller EE, Kelly M, Larsen LG. From savanna to suburb: Effects of 160 years of landscape change on carbon storage in Silicon Valley, California. Landscape and Urban Planning. 2020;195.","Beller EE, Kelly M, Larsen LG.",United States of America,"From savanna to suburb: Effects of 160 years of landscape change on carbon storage in Silicon Valley, California",2020,Landscape and Urban Planning,Peer-Reviewed Article,ebeller@google.com,N/A,United States of America,Silicon Valley,"The study area covers approximately 579 km2 of Santa Clara Valley (also known as Silicon Valley), located south of San Francisco Bay in California’s central coast ranges in the western USA (Fig. 1). The region is characterized by a typical Mediterranean climate.",Northern,N/A,N/A,Y,"Prior to agricultural intensification in the late 19th and early 20th centuries, oak savannas and woodlands (collectively referred to here as “oak lands”) dominated by the deciduous valley oak (Quercus lobata) were the defining ecological feature of the valley (Beller, Salomon, & Grossinger, 2010). Early European explorers described the valley as the “Llano de los Robles”, or Plain of the Valley Oak, and described a landscape “very thickly grown with oaks of all sizes” (Font 1776, in Bolton, 1930). The open, park-like character of these oak lands, commented on by early observers (e.g., Vancouver, [1798]1984), was likely shaped by native residents who used fire to manage vegetation growth in oak woodlands",Multi-Patch,Land use type,We reconstructed historical oak savanna and woodland composition and structure using information from historical datasets and analog modern ecosystems. These characteristics formed the basis for estimating and comparing per hectare biomass and carbon storage for each habitat type.,"Above-ground biomass, Below-ground biomass","To reconstruct tree species composition, we extracted witness trees surveyed by the GLO Public Land Survey that occurred on areas mapped as former oak lands. To calculate carbon storage for each hectare of oak savanna and oak woodland habitat based on reconstructed tree species composition, diameter distribution, and stand density. We then used species-specific allometric equations developed by the U.S. Forest Service for the iTree Eco v6 tool to calculate whole tree biomass, and converted to carbon using a ratio of 0.5.",N/A,N/A,N,Patch,"Based on the reconstructed composition and structure for oak savanna and woodland, we estimated approximately 12.6 Mg C/ha (range 2.3–22.9) in oak savanna and 80.5 Mg C/ha (range 45.9–115.0) in oak woodland. Carbon storage in riparian habitats was estimated at 83.2 Mg C/ha (95% CI 74.2–92.5; Matzek et al., 2018). . In total, thirty-six percent of the landscape experienced a loss of carbon storage across all three scenarios, while 32% experienced gains. Patterns also emerged when comparing carbon storage change across land-cover/land-use change types. For example, conversion of oak savanna to residential land-use generated an increase carbon across all scenarios, while conversion of oak savanna to commercial/industrial land-use and transportation corridors generated gains only in the low historical carbon storage scenario, and losses of carbon storage in the mean and high historical carbon storage scenarios. Conversion of oak woodland generated decreases in carbon storage across all scenarios for all major land-cover/land-use change types, including residential, commercial/industrial, and transportation corridors. Our findings suggest that in Mediterranean-climate ecosystems with heterogeneous tree cover, gains in tree carbon storage in formerly treeless areas can be offset by losses in high-biomass former woodland areas.",N,N/A,N/A,N/A,N/A,N/A,,KHT
